ID,Title,Chapter,Chapters_webp,Text,Summary
81272b52-6e2e-4cd3-9c5a-05b1183f6ad3,Talent-Swallowing Magician,71.0,"['https://cnn.kadkomi.com/komic/asura-scans/talent-swallowing-magician/chapter-71/1.webp', 'https://cnn.kadkomi.com/komic/asura-scans/talent-swallowing-magician/chapter-71/10.webp', 'https://cnn.kadkomi.com/komic/asura-scans/talent-swallowing-magician/chapter-71/11.webp', 'https://cnn.kadkomi.com/komic/asura-scans/talent-swallowing-magician/chapter-71/12.webp', 'https://cnn.kadkomi.com/komic/asura-scans/talent-swallowing-magician/chapter-71/13.webp', 'https://cnn.kadkomi.com/komic/asura-scans/talent-swallowing-magician/chapter-71/14.webp', 'https://cnn.kadkomi.com/komic/asura-scans/talent-swallowing-magician/chapter-71/15.webp', 'https://cnn.kadkomi.com/komic/asura-scans/talent-swallowing-magician/chapter-71/16.webp', 'https://cnn.kadkomi.com/komic/asura-scans/talent-swallowing-magician/chapter-71/17.webp', 'https://cnn.kadkomi.com/komic/asura-scans/talent-swallowing-magician/chapter-71/18.webp', 'https://cnn.kadkomi.com/komic/asura-scans/talent-swallowing-magician/chapter-71/2.webp', 'https://cnn.kadkomi.com/komic/asura-scans/talent-swallowing-magician/chapter-71/3.webp', 'https://cnn.kadkomi.com/komic/asura-scans/talent-swallowing-magician/chapter-71/4.webp', 'https://cnn.kadkomi.com/komic/asura-scans/talent-swallowing-magician/chapter-71/5.webp', 'https://cnn.kadkomi.com/komic/asura-scans/talent-swallowing-magician/chapter-71/6.webp', 'https://cnn.kadkomi.com/komic/asura-scans/talent-swallowing-magician/chapter-71/7.webp', 'https://cnn.kadkomi.com/komic/asura-scans/talent-swallowing-magician/chapter-71/8.webp', 'https://cnn.kadkomi.com/komic/asura-scans/talent-swallowing-magician/chapter-71/9.webp']","[['TALENT SWALLOWING MAGICIAN  ,'], ['IT’S TO GIVE THIS TO THE GOD OF CAMELLIAS.', '§ GUESS THE TEMPLE  SUFFERED ALOT OF  DAMAGE BECAUSE OF THE EASTERN GENERAL.', 'THAT WOULD APPEAR  IN FAIRY TALES...', 'THIS § SUPPOSED TO BE AN ARK  PREPARE AGAINST THE ATTACKS OF', 'THE DEMON GOD.', ' CANT BELIEVE ITS IN THIS STATE BECAUSE OF R A MERE WINTER,', 'WHY  THE  ASTERN GENERAL   BEING SO PERSISTENT  LATELY?', 'RANDOM CHANGE,'], ['SE IS THIS A PART — EE OF THE ARRANGEMENTS  THAT MY ANCESTORS HAVE MENTIONED...'], ['WHO ARE WOLD', 'WHY ARE YOU LOOKING FOR CAMELLIA?', 'WHY ARE YOU TRYING TO GIVE HER', ""Re ? GOD   CAMELLIAS... STHL  wee, ISN'T HERE YET? Ba""], ['s', 'HAS MY GRANDFATHER BEEN HERE BEFORE?', 'HERE BEFORE,', 'SO, WHY HAVE YOU COME HERE?', 'I CAME BECAUSE MY ANCESTORS ADVISED ME TO GIVE HER THE ICE CRYSTAL.', 'WHERE’S THE GOD OF CAMELLIAS?'], ['SHE HAS WITHERED.', 'IS THAT... BECAUSE OF THE EASTERN GENERAL?', 'THE WIVTER WAS T LOVG.', 'COMING EVERYONE HAS  WITHERED Away,', ""THAT'LL HAPPEN. TO US T"", ""IF I DON'T GIVE THE ICE CRYSTAL TO THE GOD OF CAMELLIAS THEN THE EE SECOND ARRANGEMENT  WON'T ACTIVATE.  S ""], [""?, THAT DOESN'T   OWAPPEN THEN I WON'T "", ' BE ABLE TO REBUILD MY FAMILY...   ', 'DEMON KING,', 'BE QUIET.', ""WE'RE ONLY ALLOWING YOU HERE BECAUSE OUR FRIEND IS HERE, I DON’T LIKE SEEING YOU."", 'You GvyS are nothing compared to me, Someone of', 'how dare.you.. at past', ' WAIT, THEY e  WITHERED DUE TO ', 'THE COLD? LN f', 'THERE REALLY ', 'J msmor  ACTUALLY WORK. '], ['SA'], ['At Dino', '  ——— READ AT —-—', '  FOR THE FASTEST RELEASES —', 'Ze Stes Ag AR yA DISS', 'gas galecels', 'pers  He AqHSeuC. u'], ['IT’S CURRENTLY CLOSED BECAUSE OF THE EASTERN GENERAL.', 'ANN we i yy', ""I ALREADY TOLD THEM THAT WE'D BE ARRIVING, SO THEY’LL OPEN THE DOORS FOR US SOON."", 'WHAT DO YOU MEAN?', ' MADE FOR WHEN THE Ce Oyo '], ['Tenn DRAGONS, AND GIANTS THAT HAD BEEN', 'ty DRAGONS  GIANTS AND THE ', 'DEMON GOD...  ', 'yo Mey ef THE', 'HOW IS IT  RELATED TO WHAT I , SAW BACK THEN? Ge'], ['ELRIC, LOOK sas OVER THERE! J', 'THE DOOR IS OPENING!'], ['I’M THE LANDSCAPER THAT MANAGES THE TEMPLE OF R—', 'FLOWERS. MY NAME IS HUNIATROQUAZ', 'YOU MAY ADDRESS ME AS THE LANDSCAPER.', 'IN FIRST.', 'PLEASE COME', 'SINCE THE WINDS ARE COLD OUTSIDE, '], ['At  Dino Adaptation Younggeun Story Original Bread Eating Squirrel', 'WHEN WINTER COMES, THE TEMPLE OF FLOWERS BEGINS TO REST. '], [""NORMALLY, WE DON'T ACCEPT ANY VISITORS DURING THIS SEASON,"", 'BUT, THANKS TO THE EARNEST PLEA OF THE TIGER KING WHO HAS BEEN OUR LONG-TIME SUPPORTER, WE DECIDED TO ACCEPT VISITORS THIS TIME.', 'SO, I HOPE ALL OF YOU DO YOUR BEST TO FOLLOW OUR INSTRUCTIONS.', 'PLEASE PAY EXTRA ATTENTION TO HOW YOU BEHAVE BECAUSE GOD” HAS GONE INTO HIBERNATION...', 'THIS IS DAFFO, THE GOD OF DAFFODILS.', ""SHE'S NOT JUST A FAIRY, SHES  A GOD?"", 'A PRETTY LADY!', ""OH MY! THANK YOU YOU'RE BEAUTIFUL TOO."", 'A MONSTER! A MOVISTER! AVI OLD AIO', 'GLOOMY MONSTER!'], [""HOW COULD SOMEONE WHO'S"", 'LIVED FOR MORE THAN', 'A THOUSAND YEARS CALL ME OLD?', 'ONE-SIDED LOVE! NEED TO WORK HARD! PRETTY!', 'WHAT A NOISY GOD...', 'ED! DARK! LOTS OE', 'LOOKING AT HOW UGLY YOU ARE. . YOURETHEPUMPKIN  FLOWER... af', 'NO, THE JASMINE FLOWER?'], [""I’M THE DAFFODIL! I'M NOT"", 'UGLY! THE LADY SAID I WAS PRETTY!', 'YOU REALLY THINK A HUMAN WAS BEING HONEST  JUST BECAUSE SHE SAID SOMETHING NICE?', 'ARE YOU REALLY A GOD?', ""I WASN'T"", 'EXPECTING HER', 'TO BE ABLE TO SEE MEPHI...', 'WHY IS THE GOD OF DAFFODILS ACTING THAT WAY?', 'IS THERE SOMETHING THERE?', 'AT THIS RATE, Ee THEY MIGHT FIND .', '  OUT ABOUT MEPIS EXISTENCE...', 'g ', ""DAFFO DOESN'T HAVE MANY FRIENDS SO SHE’S JUST PLAYING BY HERSELF."", ""I'M NOT ALONE!"", 'WHAT BUSINESS DO YOU HAVE TO VISIT OUR TEMPLE?']]","In this chapter of Talent Swallowing Magician, the characters engage in a tense dialogue concerning the condition of the Temple of Camellias, which has suffered greatly due to the Eastern General's relentless attacks. One character expresses disbelief over the state of the temple, attributing the damage to a mere winter. There is a sense of urgency as they discuss the need to activate the second arrangement to prevent their family from suffering a similar fate.A newcomer reveals his purpose: to deliver an ice crystal to the God of Camellias, who is currently withering away due to the cold imposed by the Eastern General. However, doubts arise about the God of Camellias' well-being and the historical context of their struggles. The group faces obstacles but is eventually welcomed by Huniatroquaz, the landscaper of the temple, who explains the temple's current status during the hibernation period of the gods and emphasizes the need for proper behavior during their visit. Amid humor and miscommunication, we meet Daffo, the God of Daffodils, who dramatizes her charm and unexpectedly draws complaints from the other characters. The chapter ends on a note of uncertainty as the God of Daffodils seems to hide something, setting the stage for conflict regarding her existence."
cf3919d7-70b6-46c4-bad8-6afb7e6f379e,Talent-Swallowing Magician,72.0,"['https://cnn.kadkomi.com/komic/asura-scans/talent-swallowing-magician/chapter-72/1.webp', 'https://cnn.kadkomi.com/komic/asura-scans/talent-swallowing-magician/chapter-72/10.webp', 'https://cnn.kadkomi.com/komic/asura-scans/talent-swallowing-magician/chapter-72/11.webp', 'https://cnn.kadkomi.com/komic/asura-scans/talent-swallowing-magician/chapter-72/2.webp', 'https://cnn.kadkomi.com/komic/asura-scans/talent-swallowing-magician/chapter-72/3.webp', 'https://cnn.kadkomi.com/komic/asura-scans/talent-swallowing-magician/chapter-72/4.webp', 'https://cnn.kadkomi.com/komic/asura-scans/talent-swallowing-magician/chapter-72/5.webp', 'https://cnn.kadkomi.com/komic/asura-scans/talent-swallowing-magician/chapter-72/6.webp', 'https://cnn.kadkomi.com/komic/asura-scans/talent-swallowing-magician/chapter-72/7.webp', 'https://cnn.kadkomi.com/komic/asura-scans/talent-swallowing-magician/chapter-72/8.webp', 'https://cnn.kadkomi.com/komic/asura-scans/talent-swallowing-magician/chapter-72/9.webp']","[['XX f', 'TALENT SWALLOWING MAGICIAN . ', 'ea a nL'], ['yp ? BUT IF I', 'e Zz SWALLOW IT, TLL  BEABLETOOBTAINAN  “Wwmense amount yA OF POWER... ', ' CAN GROW WAY STRONGER THAN', 'I’M TO PUT THE EASTERN GENERAL INTO THE SEAL OF CRUELTY LIKE I LEARNED IN THE FIRST ARRANGEMENT, RIGHT?', 'SINCE THIS IS THE SECOND ARRANGEMENT, IM SURE MY OPPONENT WILL BE  MUCH STRONGER THAN THE  SNOW MOUNTAIN KING.  ', 'DO I JUST NEED TO FIGHT LIKE I DID WITH THE', 'HERE, TAKE THIS.'], ['ve SEED OF ', 'WHAT AM I SUPPOSED TO DO WITH THIS...?', 'GROW THAT INTO A TREE WITHIN A HUNDRED DAYS.', 'WHEN A FLOWER BLOOMS, THIS ARRANGEMENT WILL BE OVER.', 'IT’S JUST GROWING A TREE?!', 'wi Aye Oa esasa', 'ws Se Ag AE e opyA a SMayowlT are wera'], ['At  Dino Adaplation Younggeun Story Original Bread Eating Squirrel', 'I’M ELRIC MERBINGER, THE GRANDSON OF USDON MERBINGER.', 'MAY T ASK WHAT PROMISE YOU HAD WITH MY GRANDFATHER?', 'bib You , HAVE A GOO SLEEP?'], ['EVERYONE, QUIET!', 'TI THE MIDDLE OF AVI IMPORTANT CONVERSATION, SO PLEASE STAY QUIET.', 'HOW ARE YOU GUYS ALWAYS  NOISY?', 'Ss  THE GOD OF e', ' CAMELLIA IS A LITTLE   DIFFERENT COMPARED TO    THE REST, SHES QUITE E', 'SO MUCH TIME HAS PASSED, YET YOUR UGLY MUG REMAIVIS THE SAME.', ""THE OVILY THIVIG WORTH SEEING WAS YOUR BODY, BUT YOU'VE BECOME SO PUNY."", ""YOU WOM'T EVEN HAVE AMY SUBJECTS. WHO WOULD RECOGNIZE YOU AS KING EVEN IF YOU CALL"", ""BY THE WAY, OID YOU SAY YOUR NAME WAS ELRIC? THAT'S A BEAUTIFUL AME."", 'HOw bib YOu WAKE ME UP?', 'I FELT DEMONIC ENERGY HIDDEN BY COLD ENERGY IN THE SEED YOU WERE SLEEPING IN. '], [""SO I THOUGHT I'b BE ABLE TO WAKE YOU UP IF I ABSORBED THE TWO ENERGIES THROUGH MY SEAL ANID THE"", 'AS YOU CAN SEE, IT WAS A SUCCESS.', ""HMM... YOU'RE AS WISE AS YOU'RE GO-LOOKING."", 'THANK YOU...', 'YOU.', ""THERE SHE GOES AGAIN! YOU'RE STILL THE SAME AS EVER, LUSTING"", 'OVER GOOD LOOKS.', 'AN YOUR INFERIORITY COMPLEX REMAINS THE SAME.', 'rm NOT TALKING TO THE UGLY DEMO KING,  STAY OUT OF THIS.', ""WHAT  YOU THIUK? THIS HONORABLE OPPORTUNITY WOU'T COME KNOCKING TWICE."", ' REPLIED WITH WHAT KIND  OF NONSENSE IS THIS?"" j  ', "" BUT I CAN'T ACT THAT  WAY TOA GOD WHOS AE PART OF MY FAMILY’S  ARRANGEMENT..."", 'THANK YOU FOR YOUR PROPOSAL,', 'BUT I CAN’T JUST GET MARRIED RECKLESSLY SINCE I REPRESENT MY HOUSEHOLD. I APOLOGIZE. '], ['OH MY, WHAT', 'EVOUGH WITH THE SMALL TALK.', 'YOU WANTED TO KVOW ABOUT THE PROMISE THAT WAS MADE WITH USWOM MERBINGER, RIGHT?', 'HE SAI THAT HIS GRAVIDFATHER WOULD COME HERE ONE DAY,', 'DACA HE SIVA HAT HAS COVERED TUE GLACK SNOWETELD.', 'SPRING WITH HIM.', 'HOW DOES HE KNOW', ' ALL OF IT...?', ' GRANDFATHER... ', 'WOULD YOM SEAL WIS LONGING'], [""«.L DON'T KNOW IF I CAN STEAL THE THING KNOWN AS WINTER,"", 'BUT MY ANCESTOR TOLD ME TO GIVE THIS TO YOU AND TO TELL YOU THIS.', ' AM HERE He ae', 'OTTO HAM...', 'THAT MUST BE THE ADVICE OF THAT ANNOYING MAN.', 'THIS MIGHT ALL BE A SINGLE FLOW THAT COUMECTS EVERYTHING.', 'FROM THIS DAY FORTH, GO TO'], ['AND LEARN HOw YOU CAM TAKE WIVITER AWAY,', 'IT’S BEEN A WHILE SINCE I FELT LIKE THIS.', 'THIS IS... THE TEMPLE OF FLOWERS?', 'THIS S EXACTLY HOW TI IMAGINED IT WOULD BE...'], ['THIS IS THE BLACK SNOWFIELD.', ""IT'S THE TESTING GROUND FOR THE SECOND ARRANGEMENT."", 'COULD YOU... BE...?', 'YES, IT’S BEEN A WHILE', ""YOU'VE GROWN SO MUCH SINCE WE LAST MET."", 'IT SEEMS THE SEAL OF CRUELTY HAS FOUND ITS PLACE AS WELL. '], ['HOW ARE YOU HERE?', 'UNTIL YOU COMPLETE WINTER,', 'I INTEND TO KEEP FOLLOWING YOU AROUND AND NAG AT YOU.', 'ALRIGHT. WE DON’T HAVE MUCH TIME, SO I’LL EXPLAIN RIGHT AWAY.', 'LOOK OVER THERE.', 'THIS PLACE WAS ORIGINALLY THE LAND OF BLESSINGS WHERE ALL LIFE IS BORN.', 'BUT WHEN THAT APPEARED, DEATH DESCENDED UPON THIS PLACE.', 'THE EASTERN GENERAL...', 'SO, MY DESCENDANT.', ""FROM NOW ON, YOU'LL BE LEARNING HOW TO SWALLOW THE"", 'EASTERN GENERAL ']]","In this chapter, Elric Merbinger contemplates his path towards gaining immense power by utilizing the swallowing magic he learned. If I swallow it, I'll be able to obtain a tremendous amount of power, he thinks, recalling his ultimate goal: I want to put the Eastern General into the Seal of Cruelty. He realizes that the challenges will be greater this time, as his opponent is expected to be stronger than the Snow Mountain King.Confused about the task at hand, he receives a seed which he learned must grow into a tree within a hundred days. It's just growing a tree?! he questions incredulously. Meanwhile, he meets the God of Camellia, who chides him for his appearance, hinting at a grudging familiarity between them. They discuss a promise made by Elric's grandfather, a connection that becomes significant as she remarks on their family's history.Elric finds himself entangled in the implications of this promise and is cautious about taking rash actions: I can’t just get married recklessly since I represent my household. The God of Camellia implies that this journey is interconnected with his ancestors.After a significant revelation about the history of the Black Snowfield, Elric prepares to face his next challenge in the Temple of Flowers. It’s established that this land was once a blessing, now tarnished by the appearance of death. With determination, Elric gears up for a daunting task ahead as he learns about his lineage and the necessity of swallowing the Eastern General to fulfill his destiny."
2cbb24c3-dfd1-4134-9517-3e14abd94be9,Talent-Swallowing Magician,73.0,"['https://cnn.kadkomi.com/komic/asura-scans/talent-swallowing-magician/chapter-73/1.webp', 'https://cnn.kadkomi.com/komic/asura-scans/talent-swallowing-magician/chapter-73/10.webp', 'https://cnn.kadkomi.com/komic/asura-scans/talent-swallowing-magician/chapter-73/11.webp', 'https://cnn.kadkomi.com/komic/asura-scans/talent-swallowing-magician/chapter-73/12.webp', 'https://cnn.kadkomi.com/komic/asura-scans/talent-swallowing-magician/chapter-73/13.webp', 'https://cnn.kadkomi.com/komic/asura-scans/talent-swallowing-magician/chapter-73/14.webp', 'https://cnn.kadkomi.com/komic/asura-scans/talent-swallowing-magician/chapter-73/15.webp', 'https://cnn.kadkomi.com/komic/asura-scans/talent-swallowing-magician/chapter-73/16.webp', 'https://cnn.kadkomi.com/komic/asura-scans/talent-swallowing-magician/chapter-73/17.webp', 'https://cnn.kadkomi.com/komic/asura-scans/talent-swallowing-magician/chapter-73/2.webp', 'https://cnn.kadkomi.com/komic/asura-scans/talent-swallowing-magician/chapter-73/3.webp', 'https://cnn.kadkomi.com/komic/asura-scans/talent-swallowing-magician/chapter-73/4.webp', 'https://cnn.kadkomi.com/komic/asura-scans/talent-swallowing-magician/chapter-73/5.webp', 'https://cnn.kadkomi.com/komic/asura-scans/talent-swallowing-magician/chapter-73/6.webp', 'https://cnn.kadkomi.com/komic/asura-scans/talent-swallowing-magician/chapter-73/7.webp', 'https://cnn.kadkomi.com/komic/asura-scans/talent-swallowing-magician/chapter-73/8.webp', 'https://cnn.kadkomi.com/komic/asura-scans/talent-swallowing-magician/chapter-73/9.webp']","[[' SUMO MAGICIAN BSW y', 'fan', ' asuta.ggtiscord  agurascans.com age ae Ug ie ;'], [""I DIDN'T KNOW THIS PLACE HAD A BUFFET FOR ME."", ""YOU'RE SO COMPETENT, JUST LIKE HOW A MERBINGER SHOULD BE,"", ' YOU THINK YOu CAM FINO THAT LAVIO It THIS WIDE SOWFIELD?', 'E IT NEEDS TO BE ', 'SA PLACE WITH WATER  NEAR IT...', 'J wwoapiacercan E  EASILY DEFEND FROM', ""CAMELLIA, IF WE'RE  YEARS IN THE PAST,"", 'ANTHROMORPH SHOULD BE AROUND, RIGHT?', 'OHOHO. YOU THOUGHT OF AUTHROMORPH, HUH?', ""I THIMK THEY'RE ABOUT TO COMPLETE THE COUSTRUCTION OF THE CITY RIGHT AROUIO THIS TIME."", 'THIS TERRAI IS VERY DIFFERENT FROW WHAT YOU NOW OF THOUGH.', 'HOw  You INTEND TO LOCATE AUTHROMORPH?', ""WELL, THAT'S"", 'NOT DIFFICULT.'], [""USUALLY, THE TALL GORGES OR HILLS WON'T EXPERIENCE MUCH CHANGES IN JUST  YEARS."", 'IF IT USE SUCH A PLACE AS MY CENTER, I SHOULD BE ABLE TO', 'ROUGHLY GUESS', 'WHERE IT IS.', 'HERE IT IS. FOUND IT.', ""LOOKS LIKE YOU PAID ATTEVTION TO AVITHROMOREH'S SURROUNDING TERRAINS AND REMEMBERED THEW."", ""THAT'S A SMART WECISIOV, BEFITTING A MERBINGER."", 'ALRIGHT THEN, TIME TO PREPARE'], ['J THIS SHOULD BE ENOUGH TO PLANT A TREE, RIGHT?', "" OOW'T THINK IT’S"", ""THE SOIL’S QUALITY IS GOOD, AND MOST MONSTERS WON'T BE COMING IN."", 'IKNOWHESA  MERBINGER, B S', 'BUT FOR A HUMAN “EE TO BEABLETOUSE  DRAGON TONGUE SO PERFECTLY...', 'F  WHAT SHOULD I  DOWITHHM...?'], [""SEEING HOW THE STONE TABLET HAS REACTED, I THINK I'VE SUCCEEDED."", 'AA... BACK TO THE START AGAIN.', 'THIS IS... THE DOING OF THAT PERVERTED OLD MAN, OTTO WAN, RIGHT? '], ['DURING THE FIRST ARRANGEMENT, I WOULD GO BACK TO THE START WHENEVER I DIED.', 'THIS TIME, I’M RESTARTING WHEN I FAIL THE MISSION.', 'I GUESS YOU MISSED SOMETHING.', 'DO YOU KNOW WHY THIS IS HAPPENING?', ""SIMCE THIS IS THE BLACK SMOWFIELW, THERE ARE PLENTY OF REASONS IT WOULDM'T WORK HERE."", ""vt ANY CASE,  THINK I'VE PROVIDED ENOUGH GUIDANCE,"", ""I'M GOING TO SLEEP FOR A UTTLE WHILE TO TAKE A LOOK AT THE OUTSIDE WORLD."", 'WHERE ARE', 'YOU GOING?', ""I'M GOING TO A SAFE PLACE."", 'FOCUS ON CLEARING THE MISSION UNTIL T COME BACK.', 'BEFORE YOU LEAVE, GIVE ME SOME OTHER HINTS...', ""I GUESS I'LL HAVE TO FIND OUT THE REASON I FAILED BY MYSELF.""], ['THAT BELOW THE LAND...?', ""I THINK THERE'S SOMETHING THERE...""], ['mar.', ' fi  last ', 'So ', 'Chey are big enough to swallow most large-sized monsters,', 'Tt is one of the strongest monsters, Elven three or four -circle magicians would have a hard time fighting '], ['Ti you run into it by chance,', 'runt aWay.', '- MONSTER ILLUSTRATED BOOK INFORMATION ABOUT WORM-TYPE MONSTERS-', 'Zaye Stresses Ag AR yA', 'DISS Bae weeds', ' HzalAso H Tha east Oe Aaa eo RSS Ue AzEASULC  USS SU Zial Y Pet Salt AS SAUCh'], ['GROW THAT INTO A TREE WITHIN A HUNDRED DAYS.', 'FLOWER BLOOMS, THIS ARRANGEMENT  WILL BE OVER.', 'd wy irssust', 'a crownga ', '  TREE my ', ""WHAT'S WRONG? IS THAT TOO TOUGH?"", 'FIRSTLY, T’S ABOUT GROWING THIS SEED IN THIS ROTTEN LAND,', 'BUT I ALSO DON’T UNDERSTAND WHAT THIS HAS GOT TO DO WITH THE EASTERN GENERAL.', ""WELL,  YOU'LL FIND OUT IN TIME."", 'that dont make sense again'], ['x JF wouoirKu  HIM  EXPLAIN IT  “ALITTLE More  CLEARLY?  im hatgan', 'ASSIGNING THE PERFECT GUIDE FOR YOU.'], ['CHILD?', 'p iS fe a  fo ', 'KNOW ME, HANDSOME', ' THE GOD OF CAMELLIA?!'], ['ALTHOUGH SHE’S SHORT, IT FEELS LIKE I’M LOOKING AT A HUMONGOUS TREE.', 'A HUMONGOUS TREE THAT CAN EASILY COVER THE WHOLE SKY.', ""LET ME INTRODUCE YOU TO HIM. HE'S MY DESCENDANT."", ""IT’S A PITY THAT YOU'RE A MERBINGER,"", ""BUT I'LL LET IT SLIDE SINCE YOU'RE HANDSOME."", ' YOU WANT TO MARRY WE?', ' HER PERSONALITY IS', 'THE SAME, THOUGH... x  ny', 'PROPOSAL ONCE HUH? '], [""DID SHE GET CONNECTED TO  THE CAMELLIA THAT'S OUTSIDE "", 'EN OF THE ARRANGEMENT? ', 'Smee', 'HMPH, WHATEVER. IT’S HARD TO GROW A CAMELLIA TREE. ARE YOU SURE YOU CAN  IT?', 'TM PREPARED TO DO MY BEST.', 'TM ONLY SIMPLY GOING TO BE BY YOUR SIDE AN GIVE YOU ADVICE.', 'GROWING THE TREE IS UP TO YOU ANN OLY YOU.', ""THAT'S GOOD ENOUGH FOR ME."", 'THIS IS THE “MESSENGER” THAT ALLOWS YOU TO KNOW THE STATUS OF THE TREE IN REAL TIME. '], [""YOU'LL SLOWLY FIND OUT THE OTHER USES THAT IT HAS."", 'THE CURSE OF THE DEMON GOD KNOWN AS THE FROZEN LANDS FIRST APPEARED  YEARS AGO.', 'YOU MUST OBTAIN THE INGREDIENTS AND ITEMS THAT I TELL YOU AND USE THEM.', 'I WONDER IF THE  ENVIRONMENT OF THIS TIME PERIOD IS BETTER B,—TWAN THE OUTSIDE AN', 'A woR’s', 'WHAT DO I NEED TO START DOING FIRST?'], ['YOU NEED TO FIND THE LAND TO PLANT THIS SEED ON.', 'A LAND THAT’S GOOD FOR', 'SPROUTING.', 'q', 'I WONDER IF IT WOULD BE FASTER TO PURIFY THISLAND  AS COMPARED TO SEARCHING THE WHOLE SNOWFIELD...', 'lily', 'OH, THIS PLACE IS A WO REALM, SO IT HAS THE SAME EMIVIROMIMENT', 'Vu HEED  BE wae']]","In this chapter of **Sumo Magician**, the characters discuss their strategies and objectives as they explore the environment surrounding them. Did you know this place had a buffet for me? one character expresses excitement about the setting. The other replies, You're so competent, just like how a Merbinger should be. They ponder the importance of being near water while searching for “Authromorph” and suggest it should be close to the land’s gorges or hills, as those details haven’t changed much over time.“I’ve provided enough guidance,” one character states, indicating they are going to take a break. They remind their companion to focus on completing the mission while they are away. The mention of a monster lurking nearby raises concerns, emphasizing the dangers in their surroundings. “Growing this seed is complicated,” another character remarks, highlighting the challenges of their task amidst the unfamiliar terrain. They encounter a divine figure who humorously responds to marriage proposals but reiterates the difficulty of growing a Camellia tree.Finally, the characters strategize about where to plant a special seed and how to respond to the challenges posed by their environment, culminating in a determination to purify the land to facilitate growth. Overall, the chapter highlights themes of teamwork, strategic planning, and the mystical challenges of their magical quest."
