ID,Title,Chapter,Chapters_webp,Text,Summary
326967d9-cf65-41fc-9bc5-9ce0068f45eb,Talent-Swallowing Magician,27.0,"['https://cnn.kadkomi.com/komic/asura-scans/talent-swallowing-magician/chapter-27/1.webp', 'https://cnn.kadkomi.com/komic/asura-scans/talent-swallowing-magician/chapter-27/10.webp', 'https://cnn.kadkomi.com/komic/asura-scans/talent-swallowing-magician/chapter-27/11.webp', 'https://cnn.kadkomi.com/komic/asura-scans/talent-swallowing-magician/chapter-27/2.webp', 'https://cnn.kadkomi.com/komic/asura-scans/talent-swallowing-magician/chapter-27/3.webp', 'https://cnn.kadkomi.com/komic/asura-scans/talent-swallowing-magician/chapter-27/4.webp', 'https://cnn.kadkomi.com/komic/asura-scans/talent-swallowing-magician/chapter-27/5.webp', 'https://cnn.kadkomi.com/komic/asura-scans/talent-swallowing-magician/chapter-27/6.webp', 'https://cnn.kadkomi.com/komic/asura-scans/talent-swallowing-magician/chapter-27/7.webp', 'https://cnn.kadkomi.com/komic/asura-scans/talent-swallowing-magician/chapter-27/8.webp', 'https://cnn.kadkomi.com/komic/asura-scans/talent-swallowing-magician/chapter-27/9.webp']","[[""THEY'RE STARING AT YOU SO UNEASILY. WHY DONT YOU SAY SOMETHING TO THEM?"", ""THEY'RE STARING SO MUCH THAT EVEN THE BACK OF MY HEAD HURTS."", ""Didn't think of the finishing touch."", ""IT'S BEEN A WHILE... HASN'T IT?"", 'At DJ Dino Adaptation Younggeun Story Chiginel Bread Eating Squirrel', 'ad Eoc'], ['gee', 'ELRIC, WHO RECEIVED A MISSION TO', 'PERFECT THE WINTER AFTER HIS FIRST ASSIGNMENT.', 'HE WAS ABOUT', 'TO LEAVE THE ICE MOUNTAIN TO DO JUST THAT, BUT...', 'HE FOUND THE YETIS', 'AND THE HUMANS WHO', 'ON THE OTHER HAND, ISABEL, WHO SET OUT TO FIND', ""THE ICE MOUNTAIN KING'S GRAVE TO CURE HER"", ""FATHER'S DISEASE,"", 'WAS BEING CHASED BY THE ASSASSINS, THE BLUE WOLVES,', 'THAT HER UNCLE, PAUL VILE SENT...', 'AND AT THAT MOMENT OF DANGER...!'], ['Just  passing Satan.', 'ART FADADTATION MY OUNGGEUNSSTORY ORIGINAIMEBREADIEATINGRSQUIRREL', 'SATAN? S THAT SOME SORT OF AVANT-GARDE Are you some sort of BULLSHIT? demon worshiper?', ""YOU WOULD'VE LIVED IF YOU'D JUST PASSED..."", 'ARE YOU ALRIGHT?', 'H-HUH? WE ARE, BUT...'], ['ARE YOU... ALRIGHT?', '.--DO MAGICIANS USUALLY LAND LIKE THAT?', 'Peat be just trp?', ""Why isn't he getting back up?"", ""He's probably embarrassed."", ""! WOULD'VE MADE A BADASS ENTRANCE IF IT WEREN'T FOR THE SNOW..."", ""m ISN'T THAT... THE PERSON WHO WENT MISSING...?"", 'CHEN! ONE PERSON IS MISSING!', '; ICANT LET “a HIM GET CAUGHT UP IN THIS!', ""PLEASE RUN AWAY! THIS DOESN'T CONCERN"", 'YOu!', ""I TOLD YOU WE WON'T BE LEAVING ANY WITNESSES..."", 'YES, SOMETHING LIKE BENEVOLENCE...', ' WASTEP ON TRASH LIKE You. '], ['WHA.. WHAT IN THE WORLD.?', 'WHAT ARE  YOU DOING?! HURRY UP AND KILL HIM', ""DON'T GIVE HIM THE TIME TO CHANTS"", 'ho allowed'], ['Who... Who the hell age you...', 'Ate you doing this all the while knowing who we acer', ""I DON'T CARE WHO YOU GUYS ARE,"", ""SO WHY DON'T YOU BOW DOWN FIRST?"", ""WHO IN THE WORLD IS THAT MAN? HE'S OVERPOWERING THE BLUE WOLVES SO EASILY..."", ""NO, THAT'S NOT THE ISSUE RIGHT NOW. "", "" HE'S DEFINITELY A POWERFUL MAGICIAN, BUT"", 'IT FEELS DANGEROUS IF', 'I GET CLOSE TO- '], [' IAT LEAST FULL VOUT', 'DO You SERIOUSLY THINK YOU CAN BLOCK ME WITH MAGIC LIKE'], [' WIA  THE END YOW FUCKING PAPTAKPLY', 'YOUR HEADS GONNA BE BURIED INTO THE GROUND'], ['Unvelievavle... He wiped out the Blue Wolves in an', 'instant...', 'To think there was a magician like that on the hillside...', ""HE'S NO DOUBT AROUND MY AGE,"", 'HOW CAN HE BE SO POWERFUL?', 'IF HE\'S THAT STRONG AT SUCH A YOUNG AGE, THEN COULD HE BE AROUND THE SAME LEVEL AS TASHA NERESTA, ONE OF THE ""THREE NEW STARS’?', ""THEN, THERE'S NO WAY I WOULDN'T"", 'KNOW HIM... JUST WHO IS HE?', 'Lest in peace']]","In this chapter, tensions rise as Elric prepares to leave the Ice Mountain on a mission to perfect the winter, reflecting on his last assignment. Meanwhile, Isabel finds herself in a perilous situation, being pursued by the Blue Wolves sent by her uncle, Paul Vile, on her quest to find the Ice Mountain King's grave to save her father. Elric is caught off guard when he encounters the Blue Wolves, leading to an intense confrontation where a mysterious, powerful magician intervenes, overwhelming the assassins effortlessly. The scene is filled with confusion and curiosity as characters wonder about this newcomer’s identity and strength. They are mesmerized by his abilities, pondering if he could be on par with the renowned magician Tasha Neresta.As Elric and Isabel navigate danger, they feel the weight of their tasks and the looming threat from Paul Vile's assassins. Amidst the chaos, the chapter concludes with a sense of awe over the magician's capabilities and the mystery surrounding his origin, leaving readers eager to discover more about the unfolding story."
62605f3b-aa55-4b85-ab96-88da1a68ac90,Talent-Swallowing Magician,28.0,"['https://cnn.kadkomi.com/komic/asura-scans/talent-swallowing-magician/chapter-28/1.webp', 'https://cnn.kadkomi.com/komic/asura-scans/talent-swallowing-magician/chapter-28/2.1.webp', 'https://cnn.kadkomi.com/komic/asura-scans/talent-swallowing-magician/chapter-28/2.2.webp', 'https://cnn.kadkomi.com/komic/asura-scans/talent-swallowing-magician/chapter-28/3.1.webp', 'https://cnn.kadkomi.com/komic/asura-scans/talent-swallowing-magician/chapter-28/3.2.webp', 'https://cnn.kadkomi.com/komic/asura-scans/talent-swallowing-magician/chapter-28/4.1.webp', 'https://cnn.kadkomi.com/komic/asura-scans/talent-swallowing-magician/chapter-28/4.2.webp', 'https://cnn.kadkomi.com/komic/asura-scans/talent-swallowing-magician/chapter-28/5.1.webp', 'https://cnn.kadkomi.com/komic/asura-scans/talent-swallowing-magician/chapter-28/5.2.webp', 'https://cnn.kadkomi.com/komic/asura-scans/talent-swallowing-magician/chapter-28/6.1.webp', 'https://cnn.kadkomi.com/komic/asura-scans/talent-swallowing-magician/chapter-28/6.2.webp', 'https://cnn.kadkomi.com/komic/asura-scans/talent-swallowing-magician/chapter-28/7.webp', 'https://cnn.kadkomi.com/komic/asura-scans/talent-swallowing-magician/chapter-28/8.webp']","[[""THEY'RE STARING AT YOU SO UNEASILY. WHY DONT YOU SAY SOMETHING TO THEM?"", ""THEY'RE STARING O MUCH THAT EVEN THE BACK OF MY HEAD HURTS."", ""Didn't think of the finishing touch."", ""IT'S BEEN  WHILE... HASN'T IT?"", ""THOUGH HE e HELPED US, HE'S STILL A COMPLETE STRANGER. IT’S TOO EARLY TO LET OUR GUARD DOWN."", ' HES JUST AS DANGEROUS AS THEM IF i HE HAS SOME ULTERIOR _', 'I THANK OUR SAVIOR. '], ['HOW COULD You -NEEL...?!', ""N-NO, YOU DON'T HAVE TO GO HAT FAR..."", 'I-I THANK OUR SAVIOR!', ""DID WHAT ANYONE WOULD'VE DONE. PLEASE GET UP."", 'HO, T LOOKS LIKE SHE KNOWS WHAT COURTESY , UNLIKE THOSE TWO MORONS.', 'THIS MAY SOUND RUDE, BUT MAY I ASK OUR SAVIOR FOR A FAVOR?', "" NO, I'D LIKE"", 'TO COMMISSION ___ YOU!'], ['Art DJ Dino Adaptation Younggeun Story Original Bread Eating Squirrel', ' CAN SEE THE CORNERS OF', 'YOUR LIPS RISING, BASTARD.', ""HIDE T PROPERLY IF YOU'RE GOING To...""], [""NOT ONLY THAT, IT'S THE BLUE LION?!"", 'WERE YOU', 'A LADY OF THE tln change from Vile to Weul WEYL FAMILY? “nee the raw uses Wey!', 'OH... YES... TO MY SHAME...', 'THAT - EXPLAINS WHY...', ""SHE'S SO EXCEPTIONALLY BEAUTIFUL."", 'Scentless Flower’,', 'THOUGH HER BEAUTY WAS ENOUGH FOR EVEN THE CROWN PRINCE TO BE INFATUATED WITH HER AND ASK', 'FOR HER HAND IN MARRIAGE,', 'SHE WAS ABANDONED BECAUSE SHE WAS A FLOWER WITH NO SCENT.'], [""JUST FOR THE REASON THAT SHE WASN'T"", 'BORN WITH TALENT.', 'IF THE FLESH AND BLOOD OF THE LION DOES NOT HAVE SHARP TEETH AND CLAWS, THEN THEIR WORTH FALLS JUST AS MUCH.', '” IT HEARD SHE WAS', 'LIVING LIKE A LONER IN HER ESTATE AFTER THE MARRIAGE WAS BROKEN OFF... W', 'an ', ' OS', ""MY NAME IS 'RIC’. IT'S AN HONOR TO MEET THE ONLY DAUGHTER OF THE BLUE LION."", 'WHY WOULD IT BE AN HONOR TO MEET SOMEONE LIKE ME...?', ""IT'S OKAY TO HAVE CONFIDENCE."", ""FROM WHAT I'VE SEEN, YOUR TENACITY WAS ONE THAT WOULD NOT SHAME"", 'THE NAME OF THE BLUE LION.', 'RIGHT. YOU SAID SOMETHING ABOUT A COMMISSION, RIGHT?', 'OH, YES.', ""I DON'T HAVE ANYTHING BUT THAT AT THE MOMENT, THOUGH...""], ['MAY I SHAMEFULLY ASK YOU TO ESCORT US TO THE IMPERIAL CAPITAL?', ""YOUNG MISS! WE STILL HAVEN'T FOUND THAT PLACE-"", ""I DON'T WANT TO LOSE EVEN YOU GUYS BECAUSE OF MY OWN GREED."", ""I'M GOING TO GO MEET WITH MY UNCLE TO NEGOTIATE WITH HIM FIRST."", ""THOSE KNIGHTS LOOK LIKE THEY'RE PART OF THE WEYL"", 'FAMILY TOO... -', 'ARE THERE SOME INTERNAL STRUGGLES WITHIN THE WEYL FAMILY?', 'COME TO THINK OF IT,', 'I HEARD THE BLUE LION WAS SICK WITH THE REFLUX DISEASE’, SOMETHING SIMILAR TO THE BLOCKAGE DISEASE...', ""COULDN'T I USE THIS TO MAKE THE BLUE LION INDEBTED TO ME?"", 'IF THE REVIVED MERBINGER JOINS HANDS WITH THE BLUE LION...', 'elusive The revved Ne', ""Exclusive Merbinger resolves the Blue Lion's Reflux Disense"", 'Lion shaking honds while sing ', 'i'], [""THOUGH WE'RE LACKING TO BORROW YOUR SKILLS,"", ""T'D LIKE TO GIVE YOU ABOUT TWO TIMES WHAT I JUST GAVE YOU"", 'AS A REWARD UPON', 'COMPLETION...', ""I GUESS YOU CAN'T,"", 'THERE ARE TONS OF TREASURES IN '], [""THAT DANN SHYNAYK'S NEST, SO WHY DO YOU NEED MONEY?"", 'ST AT A ', ""E DON'T SAY   SOMETHING LIKE THAT   IF YOU'VE NEVER BEEN  COLP ANP HUNGRY  BEFORE. "", ' WHAT AM Zs  ISUPPOSEDTODO ', ""  WHENIDON'T HAVE  “ ANY MONEY ONME  RIGHT NOW? a"", 'C IT WGHT NOT —_', ' MATTER TO YOU, MEP, ', 'GHOST, BUT HUMANS ', 'NEED MONEY TO EAT   AND SLEEPL', 'THIS  THE PROBLEM WITH HUMANS...', '"" ANYWAY... THE   \'SOLIND CONDUCTION’   THING IB PRETTY —', 'CONVENIENT. ', 'I CAN SEND Z WORDS TO THE TARGET  I WANT WITH ONLYA ', 'SMALL AMOLINT ', 'OF MANA. ', 'wi Wel', 'LONLY TAUGHT', 'YOU BECAUSE  WAS SO ANNOYED WITH YOU KEEPING YOUR MOUTH SHUT WHEN ANYONE ELSE WAS AROUND.', ' NO WONDER YOU   HATEP BEING MLITED  SO MUCH, YOU CHATTERBOX. ', 'i YY? aly  ', 'H-HOW DARE YOU?!', 'Forget Thats ave you gamma Ree that the eshale coy Star Vow aole nave tiidlaows', 'fan gp already cara, '], [""HE'S NOT SAYING A WORD..."", 'ISIT BECAUSE  I COMMISSIONED HIM...?', 'BUT RIGHT NOW, I NEED HIS HELP.', 'IF UNCLE SENDS EVEN STRONGER BLUE WOLVES...', 'f he a OS PON', ""THERE'S NO WAY THE THREE OF US"", 'CAN BLOCK THEM.', 'Wow', 'a     i', 'SQUAD  HAS BEEN ANNIHILATED?'], [""IF YOU'RE SORRY,"", ""THEN YOU SHOULDN'T HAVE DONE SOMETHING TO BE SORRY FOR IN THE FIRST PLACE."", 'HOW DO YOU THINK ISABEL WILL MOVE?', 'SINCE TRACES OF HER LEAVING THE ICE MOUNTAIN HAVE', 'BEEN CONFIRMED,', ""SHE'LL MOST LIKELY RETURN TO THE IMPERIAL CAPITAL."", ""IF SHE'S RETURNING TO THE MPERIAL CAPITAL, THEN THAT MEANS SHE'LL"", 'TRY TO NEGOTIATE', 'WITH ME?', 'Blue Wolf Gquad  Teader HILTON'], ['WHAT A STUPID Cc', 'HOW DARE SUCH AN INCOMPETENT GIRL TRY TO NEGOTIATE WITH ME...?', 'YOU ONLY', 'HAVE ONE CHANCE.', 'Ht J EO x eee']]","In this chapter, tensions rise as characters navigate complex feelings towards a mysterious savior. They're staring at you so uneasily, one character remarks, hinting at the unease in the air. Another suggests, It's too early to let our guard down, reflecting suspicion despite gratitude. One individual, grateful yet hesitant, acknowledges their rescuer, saying, I thank our savior! while another dismisses the praise, insisting, I did what anyone would've done. The conversation then shifts to a request for a favor, as one character tentatively asks for an escort to the imperial capital, stating, I don't want to lose even you guys because of my own greed.Amid discussions about past betrayals within the Weyl family and personal insecurities, a character addresses their lineage, revealing, It’s an honor to meet the only daughter of the blue lion. However, this is met with an unexpected response of disbelief, Why would it be an honor to meet someone like me?The chapter builds on the theme of internal struggles and ambition, as plans are set in motion to negotiate with powerful figures, and the threat of stronger enemies looms. If uncle sends even stronger blue wolves, worry shifts to the group's ability to defend themselves, noting their squad had already faced annihilation. Amidst it all, one character reflects on the precariousness of their situation, warning that you only have one chance, setting the stage for high stakes moving forward."
55e854f7-9a01-4a0b-826d-337d4630aed2,Talent-Swallowing Magician,29.0,"['https://cnn.kadkomi.com/komic/asura-scans/talent-swallowing-magician/chapter-29/1.webp', 'https://cnn.kadkomi.com/komic/asura-scans/talent-swallowing-magician/chapter-29/10.webp', 'https://cnn.kadkomi.com/komic/asura-scans/talent-swallowing-magician/chapter-29/2.webp', 'https://cnn.kadkomi.com/komic/asura-scans/talent-swallowing-magician/chapter-29/3.webp', 'https://cnn.kadkomi.com/komic/asura-scans/talent-swallowing-magician/chapter-29/4.webp', 'https://cnn.kadkomi.com/komic/asura-scans/talent-swallowing-magician/chapter-29/5.webp', 'https://cnn.kadkomi.com/komic/asura-scans/talent-swallowing-magician/chapter-29/6.webp', 'https://cnn.kadkomi.com/komic/asura-scans/talent-swallowing-magician/chapter-29/7.webp', 'https://cnn.kadkomi.com/komic/asura-scans/talent-swallowing-magician/chapter-29/8.webp', 'https://cnn.kadkomi.com/komic/asura-scans/talent-swallowing-magician/chapter-29/9.webp']","[[], [""WE'VE ARRIVED AT LACENTE, YOUNG MISS."", 'WE ARRIVED IN ONLY TWO DAYS FROM MOVING WITHOUT REST.', 'MY BODY ACHES ALL OVER..', 'EHH? A  FLOATING GHOST LIKE YOU...?', 'J', "" DON'T YOU Ea KNOW THE CORRECT  _"", 'THE MIND? ', 'WHY IN THE  WORLPDIP YOU  — STAYUPSIDE  — DOWN-? ', 'g YY', 'THOSE ARE...?', 'GATHER THE BLUE WOLF SQUAD .', 'MUST WE MOBILIZE OUR MOST POWERFUL SQUAD FOR SOMETHING SO TRIVIAL?', 'THE YOUNG LADY RETURNING TO THE CAPITAL IS NO DIFFERENT FROM A DECLARATION OF SURRENDER- '], ['SHOULD', 'ACT LIKE ONE.', 'SHE WILL NO DOUBT PASS THROUGH ""LACENTE"" IF SHE\'S COMING FROM THE ICE MOUNTAIN TO THE IMPERIAL CAPITAL.', 'TURN THAT', 'PLACE...', 'INTO THEIR GRAVES.', 'Wy Ps ', ""I DID EXPECT THAT WE WOULDN'T BE ABLE TO MOVE FREELY SINCE THE LORD RULES OVER"", 'THIS PLACE,', 'BUT I NEVER EXPECTED IT TO THIS EXTENT...', 'SHOULD WE TURN BACK, YOUNG MISS?', ""WE'VE ALREADY CAUGHT THEIR ATTENTION. IT'LL ONLY MAKE THEM MORE SUSPICIOUS."", ""LET'S ABANDON THIS CARRIAGE, GET OUT IN SECRET, AND FIND ANOTHER"", 'WHAT? WHAT DO YOU...?'], ['JUST WHAT MAGIC  You use?', 'JUST A SIMPLE ILLUSION MAGIC THAT MAKES OUR APPEARANCE LOOK LIKE SOMETHING ELSE FOR A MOMENT.', ""IT'S NOTHING MORE THAN A HYPNOSIS THAT CAN BREAK WITH EVEN THE SLIGHTEST SHOCK, SO WE HAVE TO BE CAREFUL."", ""WE'VE ENTERED THE CITY SAFELY THANKS TO YOU, SIR RIC."", 'I THANK YOU FROM THE BOTTOM OF MY', 'HEART!', 'THEN,', ""LET'S STAY THE NIGHT HERE. I'LL BE RIGHT BACK ON SOME BUSINESS TO TAKE CARE OF."", 'COME BACK SAFELY!'], [""WHY DID YOU GO OUT OF YOUR WAY TO USE ILLUSION MAGIC WHEN YOU COULD'VE JUST WIPED THEM ALL OUT?"", "" I DIDN'T   WANT TO FIGHT WHEN"", ""_ I DIDN'T EVEN KNOW “ THE SCALE OF OUR ENEMIES. x"", ' IALSO “  NEED TO CONSERVE i My MANA FOR', 'WHAT DO YOU THINK THE SOUL SPEECH AND SEALS ARE FOR? ARENT YOU JUST LAZY?', ""IN ANY CASE, SHOULDN'T YOU GO TO THE ACADEMY OR WHATEVER SOON?"", 'YES, BUT I NEEP TO FINP SOMETHING OLIT FIRST.', ' y TANS tal Joa Maa', ""QUITE SOME TIME HAS PASSED, BUT I'M SURE YOU ALL HAVEN'T FORGOTTEN, RIGHT?"", 'we le ed ey ""wed SS', 'a Wh VOUS for', 'I NEED TO ce KNOW WHAT SORT OF SITUATION OLIR DEAN E  IN SO THAT I CAN  a PREPARE HOW TO FUCK HIM OVER.', 'Ape', ""« DON'T KNOW WHO HE , BUT WHAT AN UNLUCKY MAN, BEING MARKED BY YOU."", ' HAVE A QUESTION.', ' FELT SOMETHING SIMILAR TO MANA FROM THOSE KNIGHTS. WHAT EXACTLY WAS IT?', '. “ Ss is S', 'OHH, I GUESS Zz ""AURA CHAIN"" DIDN\'T  EXIST IN YOUR', 'AURA CHAIN?', 'MANA   ORIGINALLY A — BLESSING GIVEN a TO MAGES,', 'BUT AS TIME FASSEL, EVEN MARTIAL ARTISTS — DEVELOPED A METHOP', 'Zz TO AFPLY MANA TO z THEIR BODIES,', 'ig fA AA, dor aN '], [' Ay', ' IF MAGES USE   MAGIC BY CREATING   WANA CIRCLES IN THEIR HEARTS,', 'Mi phe A pox WS', 'ARTISTS STRENGTHEN THEIR BODIES BY WEAVING AURA CHAINS AROLIND THEIR DANTIANS.', 'AN yt et"" NN Vad x r WY', 'THE RANKS', 'OF MARTIAL ARTISTS ARE CATEGORIZED AS T-CHAIN', 'WASTER’, AND STH-CHAIN', 'SUPERIOR’', ""n'y Won Wary SN py"", 'THERE ARE ONLY FIVE?', ' USUALLY, Z BLIT THERE S AN  EXCEPTION,  ', 'ONLY ONE FERSON HAS EVER FORMEP MORE THAN FIVE CHAINS.', 'ate  MA A fy XW YSS Haithy prod os', 'THE GOLDEN LION.', 'CONSIDERED THE STRONGEST', 'BEING IN THE CONTINENT.', 'WHAT AN ARROGANT NICKNAME.', 'NOTHING MORE THAN HUMAN STANDARDS...', ""NO, THAT'S NOT  THE CASE. "", 'Sa HE WAS ', ' A MATCH AGAINST MY GRANDFATHER, WHO WAS ONE OF THE GREATEST', 'IN THE HISTORY OF Z MERBINGER. s', ' Yo aley Aye""', ""AH, WE'RE FINALLY HERE"", 'ID LOVE TO MEET HIM ONE DAY'], [""THIS OLD MAN'S STUCK ON SOMETHING AGAIN."", ""DON'T BOTHER WITH HIM. WHAT'S MORE IMPORTANT IS..."", ""MAY T PURCHASE A MONTH'S WORTH OF NEWSPAPERS?"", 'FINDING OLIT WHAT HAPPENED IN THE TIME THAT I WAS ABSENT.', ""T STILL HASN'T BEEN TAKEN CARE OF YET?"", 'THE NERESTERS ARE GUARDING THE HOSPITAL LIKE AN IMPENETRABLE FORTRESS...', 'J Yi', 'SEAN NERESTER... THAT UNGRATEFUL', 'BRAT... BUT SINCE YOUR ACCOMPLISHMENT OF DISCOVERING THE NEST IS BEING RAISED BY THE ACADEMIC CIRCLES AND THE PRESS, YOU ARE MUCH MORE SUPERIOR TO THE OTHER CANDIDATES FOR THE HEADMASTER ELECTION APPROVAL', ""BUT YOU NEVER KNOW WHAT WILL HAPPEN IF I CAN'T OBTAIN THE EXCAVATION RIGHTS FOR THE NEST."", 'T WANT AN OVERWHELMING VICTORY.', 'JUST GIVE ME YOUR COMMAND.', 'PRESSURE THE NERESTERS EVEN MORE.', 'YOUNG MASTER, THE PRESSURE BEING PLACED ON THE TRANSFER OF THE NEST EXCAVATION RIGHTS BY THE ACADEMIC CIRCLES AND THE PRESS JS SERIOUS.', 'NOT ONLY THAT, SINCE THIS SITUATION IS NO DIFFERENT FROM YOU STABBING YOUR SUPERVISING PROFESSOR IN THE BACK, THE ACADEMIC CIRCLES ARE IN AN UPROAR.', 'My GiStew Comes to avril me every', 'Awd that loastad Elvic hasnt contacted me even once...', '\' ""im sure the readers have forgotten about me...  wanted more screen time... '], ['THE DEAN IS AS SLY AS ALWAYS...', 'IS GOING THROUGH HELL BECAUSE OF ME.', 'THE OLDER YOU ARE, THE MORE SLY YOU GET...', ""I'M GETTING More YOURE"", ""AND MORE USED To QUITE WELL, AREN'T THAT FACE.. YOU, DEAN?"", 'JUST KEEP CLIMBING LIKE THAT...', ""IT'LL ONLY MAKE MY DEBUT STAGE MORE FABULOUS."", '.. ANYWAY, I FEEL SO BAD FOR SEAN.', 'S THERE ANYTHING I CAN DO FOR HIM...?'], ['READ AT', 'FOR THE FASTEST RELEASES.']]","In this chapter, the young miss arrives at Lacente after an exhausting two-day journey, prompting concern for her safety. A floating ghost character, mysterious in nature, expresses skepticism about the need to mobilize their powerful Blue Wolf Squad for what seems like a trivial concern regarding the young lady’s return to the imperial capital, which is viewed as a potential surrender.The ghost advises caution, explaining the considerable power of the local lord and the need to keep a low profile. They decide to use illusion magic to disguise themselves rather than engage in direct confrontation. This decision rattles the young miss’s companion, who wonders why they didn’t just eliminate their enemies directly, only to learn that conserving mana is essential.As they enter the city, they contemplate their true situation and the potential dangers they face, especially in a place under tight control. There are discussions about the potential threats from knights who seem to possess a form of mana, with insights about martial artists and mages adapting to harness mana differently.The narrative then shifts as they engage in some political maneuvering regarding excavation rights that could grant them an advantage in an upcoming election, hinting at the complex dynamics of power within their society. The gravity of these political issues weighs heavily on the young master, who is determined to secure his position despite making enemies in the process.Finally, there's an underlying sentiment of nostalgia and concern for a character named Sean, who finds himself in troubled waters due to the young master's ambitions. The chapter closes on a note of uncertainty and anticipation, leaving readers curious about the unfolding political and magical challenges they must navigate."
