ID,Title,Chapter,Chapters_webp,Text,Summary
a4948ddb-da17-463b-a0ce-ddca95205e39,Talent-Swallowing Magician,0.0,"['https://cnn.kadkomi.com/komic/asura-scans/talent-swallowing-magician/chapter-0/1.webp', 'https://cnn.kadkomi.com/komic/asura-scans/talent-swallowing-magician/chapter-0/2.1.webp', 'https://cnn.kadkomi.com/komic/asura-scans/talent-swallowing-magician/chapter-0/2.2.webp', 'https://cnn.kadkomi.com/komic/asura-scans/talent-swallowing-magician/chapter-0/3.1.webp', 'https://cnn.kadkomi.com/komic/asura-scans/talent-swallowing-magician/chapter-0/3.2.webp', 'https://cnn.kadkomi.com/komic/asura-scans/talent-swallowing-magician/chapter-0/4.1.webp', 'https://cnn.kadkomi.com/komic/asura-scans/talent-swallowing-magician/chapter-0/4.2.webp', 'https://cnn.kadkomi.com/komic/asura-scans/talent-swallowing-magician/chapter-0/5.1.webp', 'https://cnn.kadkomi.com/komic/asura-scans/talent-swallowing-magician/chapter-0/5.2.webp', 'https://cnn.kadkomi.com/komic/asura-scans/talent-swallowing-magician/chapter-0/6.webp', 'https://cnn.kadkomi.com/komic/asura-scans/talent-swallowing-magician/chapter-0/7.webp']","[['TALENT-SWALLOWING MAGICIAN'], ['THE MASSIVE CONTINENT THAT', 'WE LIVE IN.', 'THE POWERS OF THE “EMPIRE” THAT DOMINATE THE CONTINENT', 'ARE DIVIDED INTO FOUR FORCES.', 'THE MERITORIOUS FAMILY THAT THE “GOLDEN LION’ RAISED, REPRESENTING MARTIAL ARTS J  AND SWORDSMANSHIP,', 'THE FORCE MADE UP OF A GATHERING OF DEVOTEES AND PRIESTS THAT WORSHIP COUNTLESS GODS ACROSS THE CONTINENT,', 'CEERSS y Set G'], ['THE INFORMATION-GATHERING GROUP THAT PROTECTS THE IMPERIAL FAMILY FROM THE SHADOWS,', 'THE CINSPECTION BUREAU.', 'THE MAGIC FORCE THAT HAS LED THE WORLD OF MAGIC FOR OVER A THOUSAND YEARS,', 'THE MAGIC TOWER.', 'THE PRESTIGIOUS MAGIC', 'FAMILY THAT NOURISHED', 'THAT MAGIC TOWER AND THE WORLD OF MAGIC,', 'S MY FAMILY, THE', 'FAMILY.'], [' YEARS AGO, AS THE WAR WITH THE DEMONS BROKE OUT,', 'OUR FAMILY BECAME THE SPEARHEAD THAT WON THE WAR.', 'HOWEVER,', 'THE MAJORITY OF THE FAMILY WAS SACRIFICED, AND WHEN T TURNED  YEARS OLD,', 'Ait MY FATHER, WHO SUFFERED FROM THE AFTERMATHS OF THE WAR,', 'MOTHER, WHO WAS MY MAGIC TEACHER, PASSED AWAY.', 'THE ONLY ONES LEFT IN OUR FAMILY WERE ME', 'AND MY OLDER SISTER.', 'THE VASSAL FAMILIES THAT SERVED OUR FAMILY', 'ALL BETRAYED US.'], ['THAT I WOULD', 'BECOME A GREAT MAGICIAN AND RESTORE THE FAMILY.', 'THAT WAS THE PLAN, BUT...', 'THE DISGRACE OF HE MELVINGER', 'FAMILY!', 'HOW LOW IS THE PRESTIGIOUS MAGIC FAMILY GOING TO FALL?', 'HAHA, IS HE REALLY THE FIRST HEADMASTER’S GRANDSON?', 'HOW CANA ie', 'MAGICIAN NOT il', 'EVEN MAKE A CIRCLE?', 'DUE TO THE RARE CONDITION, “BLOCKAGE DISEASE’, I COULD NOT USE MAGIC.', 'FORGET RESTORING MY FAMILY, T BECAME THE LAUGHINGSTOCK OF THE ENTIRE WORLD.', 'T WORKED TO DEATH TO TRY TO TREAT THE “BLOCKAGE DISEASE’,', 'BUT I COULD NOT FIND A WAY.', 'BUT THEN,'], ['T WONDER IF MY WISH REACHED THE HEAVENS.', 'T MET A DRAGON!', 'THE ONLY POSSIBILITY THAT', 'S RIGHT N FRONT OF MY EYES...'], ['MY NEW', 'VESSEL  Rs — is  hls t NOW, BECOME ONE ITH ME', 'AND LET US TAKE OVER THE WORLD, HUMAN...'], ['DAMN... IT...', 'IF  KNEW THAT IT WAS THE TEST OF THE DEMON KING’...', ' WOULD HAVE NEVER SOUGHT OUT SOMETHING LIKE A DRAGON...'], ['WILL NOT BE DEVOURED LIKE THIS!!!']]","In this chapter of Talent-Swallowing Magician, we delve into the tragic past of the protagonist, who reflects on the fallen glory of his prestigious magic family, the Melvingers. The powers of the empire are divided into four forces, he recalls, underscoring the strength of various factions that dominate their continent. Despite his family's historical significance, having led the war against demons, they have suffered devastating losses, leaving only him and his older sister.The protagonist laments, The disgrace of the Melvingers! How low is the prestigious magic family going to fall? expressing his frustration and anguish over the family's current state. Plagued by a blockage disease that renders him unable to use magic, he feels like a joke to those around him, a magician who cannot even make a circle.As he desperately tries to break free from his curse, he reflects on his dreams of restoring his family’s honor. I worked to death to try to treat the blockage disease, he admits, showcasing his determination despite his misfortune. In a twist of fate, he encounters a dragon, which presents a glimmer of hope. Become one with me and let us take over the world, human, it demands, but he resists, realizing too late that “it was the test of the Demon King.” With urgency and defiance, he vows, I will not be devoured like this! signifying a pivotal moment where he must confront the overwhelming forces that threaten to consume him. The chapter ends with a thrilling sense of determination as he prepares to fight against his seemingly insurmountable challenges."
be6406c0-1aa6-4385-9bde-b9886e91ff90,Talent-Swallowing Magician,1.0,"['https://cnn.kadkomi.com/komic/asura-scans/talent-swallowing-magician/chapter-1/1.webp', 'https://cnn.kadkomi.com/komic/asura-scans/talent-swallowing-magician/chapter-1/10.webp', 'https://cnn.kadkomi.com/komic/asura-scans/talent-swallowing-magician/chapter-1/2.1.webp', 'https://cnn.kadkomi.com/komic/asura-scans/talent-swallowing-magician/chapter-1/2.2.webp', 'https://cnn.kadkomi.com/komic/asura-scans/talent-swallowing-magician/chapter-1/3.webp', 'https://cnn.kadkomi.com/komic/asura-scans/talent-swallowing-magician/chapter-1/4.1.webp', 'https://cnn.kadkomi.com/komic/asura-scans/talent-swallowing-magician/chapter-1/4.2.webp', 'https://cnn.kadkomi.com/komic/asura-scans/talent-swallowing-magician/chapter-1/5.1.webp', 'https://cnn.kadkomi.com/komic/asura-scans/talent-swallowing-magician/chapter-1/5.2.webp', 'https://cnn.kadkomi.com/komic/asura-scans/talent-swallowing-magician/chapter-1/6.webp', 'https://cnn.kadkomi.com/komic/asura-scans/talent-swallowing-magician/chapter-1/7.1.webp', 'https://cnn.kadkomi.com/komic/asura-scans/talent-swallowing-magician/chapter-1/7.2.webp', 'https://cnn.kadkomi.com/komic/asura-scans/talent-swallowing-magician/chapter-1/8.1.webp', 'https://cnn.kadkomi.com/komic/asura-scans/talent-swallowing-magician/chapter-1/8.2.webp', 'https://cnn.kadkomi.com/komic/asura-scans/talent-swallowing-magician/chapter-1/9.webp']","[['TALENT-SWALLOWING MAGICIAN'], ['THE DISEASE THAT YOU ARE CURRENTLY SUFFERING FROM IS CALLED BLOCKAGE', 'DISEASE.', 'UNLIKE NORMAL PEOPLE, YOUR BODY SUFFERS FROM A RARE DISEASE WHERE MANA IS UNABLE TO FLOW FREELY.', 'MANA  ENERGY THAT IS ESSENTIAL TO MAGIC USERS', 'ALTHOUGH WE’VE TRIED EVERYTHING THAT WE COULD DO ON YOUR BODY...', ""M AFRAID THERE'S NOTHING THAT WE CAN DO."", 'UNFORTUNATELY,', 'YOU ARE UNABLE TO USE MAGIC FOR...', 'ARE YOU LISTENING TO ME?? HELLO???', 'el’M SORRY, SIS.', 'WHAT WERE YOU SAYING?', 'USDON ACADEMY'], ['BODY? WHAT DID THE DOCTORS SAY?', 'DID THEY FIND A CURE?', 'IF YOU NEED MORE MONEY,  CAN...', 'SIS! CALM DOWN.', 'M NOT A KID ANYMORE. YOU DON’T HAVE TO WORRY TOO MUCH.', 'LL BE CURED FROM MY DISEASE SOON!', ""HOW COULD  NOT BE WORRIED WHEN I'M THE ONLY FAMILY MEMBER THAT YOU"", 'OH, SIS! MY FRIENDS ARE CALLING ME.', '""LL CALL YOU AGAIN SOON!', "" COULDN'T BEAR TO TELL HER THE TRUTH... THAT  MIGHT NOT BE ABLE TO RETURN HOME..."", ' DSS ZY BAAEFSyA aa BASES', 'HAT?', ""WHAT? WHAT'S WRONG WITH YOUR GRADES?! DAMN... THAT PROFESSOR BARRACKS...!"", ""HEY, I'VE NEVER BEEN LATE TO CLASS AND  HAVE A D IN CLASS. A D.""], ['BUT SERIOUSLY,', ' KNEW MELVINGER', 'WAS SOMETHING ELSE.', ' PHYSICAL ELEMENTAL', 'THEORY At', 'AKKAD GEOMETRY  A', 'ANGENT SPELL PHILOSOPHY At BLAK MAGIC HISToRY  A', ' KNOW, RIGHT? HOW CAN HE BE SO CONSISTENT?', 'AT YOUR GRADES. AS CONSISTENT AS MELVINGER,  SEE?', 'IN THE END... AGAIN...!', 'PRACTICAL OFFENSIVE MAGIC', 'FALLED TO gfAssyPeQUTRED cass f ff ', 'THIS MARKS MY TH TIME FAILING.', ""ACCORDING TO THE ACADEMY'S RULES, FAILING THE TH TIME MEANS..."", '... DID MY BEST TO STUDY. Z me', 'IN ORDER TO STAY HERE,  DID MY BEST AND STUDIED AS MUCH AS  COULD.', 'AS A RESULT,  WAS ABLE TO FULLY UNDERSTAND ANY LOGIC THAT THE ACADEMY REQUIRED', 'YOU TO UNDERSTAND,', 'AND OF COURSE,  ACED THOSE THEORY EXAMS.', ""ON TOP OF THAT, ALTHOUGH  DON'T WANT TO SAY IT MYSELF,"", ' ALWAYS THOUGHT THAT  WAS SPECIAL COMPARED TO EVERYONE ELSE.', 'NOT ONLY WAS  INTELLIGENT,'], ['BUT MY ABILITY TO DETECT AND UNDERSTAND MANA WAS ALSO VASTLY BETTER THAN ANYONE ELSE.', 'FROM THEORY TO MANA ABILITIES. FOR A MAGICIAN, THOSE', ""WOULD'VE BEEN GREAT THINGS THAT THEY'D WANT TO HAVE."", 'HOWEVER,', 'ABSORB THE MANA FLOATING AROUND IN THE', 'AND GATHER IT ALL IN YOUR HEART!', 'THATS WHAT WE CALL A CIRCLE’', ""IT DOESN'T MATTER IF YOU HAVE THE TALENT THAT EVERYONE WANTS..."", 'WHY IS THAT SUNBAE STILL STRUGGLING IN A ST YEAR CLASS LIKE THIS?', 'WHY DON’T YOU GIVE UP ON MAGIC AND BECOME A SCHOLAR?', 'LL BE SURE TO PUT A GOOD WORD IN TO THE', 'HEADMASTER.', 'THIS DAMNED BLOCKAGE DISEASE.', 'BECAUSE OF IT,  CAN’T USE MAGIC. THAT MEANS, AT BEST, ALL  CAN DO IS BECOME A MAGIC SCHOLAR.', ' CAN’T BRING BACK GLORY TO MY FAMILY WITH A MERE PROFESSION LIKE THAT.'], ['HERO OF THE GREAT DEMON WAR'], ['THIS IS USDON ACADEMY’.', 'IF  GET EXPELLED FROM', 'THAT WOULD JUST MEAN THAT  WOULD BE DESTROYING THE MELVINGER FAMILY PRIDE WITH MY OWN HANDS.', 'TO THINK THAT A PERSON', 'LIKE THAT WOULD BE THE', 'GRANDSON OF THE FIRST HEADMASTER...'], ['THE “DISGRACE OF THE MELVINGER FAMILY’,', 'M TELLING YOU.', 'HOW FAR DO YOU THINK A MAGIC ROYAL FAMILY’ CAN FALL?', ""YOU'RE ST YEAR STUDENTS IN THE PHYSICAL MAGIC DEPARTMENT,"", 'DO YOU KNOW ANY ASSISTANT PROFESSORS THAT GO BY THE NAME SEAN’?', ""HE'S A REALLY CLOSE FRIEND...""], ['WHATS YOUR NAME?', 'LET ME TAKE A LOOK...', 'WITH HIS PERSONALITY, THERE’S NO WAY THAT SEAN WOULD STAND', 'OR IT...', 'DAMN YOU, SERIOUSLY!', 'GRANDFATHER... NO, EVEN IF MY FATHER WAS STILL WITH US...', "" NO, STAY  FOCUSED. YOU CAN'T  GET WEAK HERE!"", 'WILL SOLVE THIS! '], [""THIS ISN'T IT..."", 'THE ACADEMIA’S FIRST REPORT?', ""DAMN. THERE'S NOTHING ON BLOCKAGE DISEASE.""], ['AH FUCK? WHAT’D YOU JUST SAY?', 'HAVE YOU BEEN USING MY NAME AS YOU PLEASED AGAIN?', 'RD SON OF THE NERESTER FAMILY SEAN NERESTER', 'OH, LOOK WHO IT IS!', ""ISN'T IT THE GREAT AND FRIENDLY SEAN NERESTER’?"", ""SERIOUSLY. DIDN'T  TELL YOU TO STOP BOTHERING THE YOUNG ONES BY SELLING MY NAME?"", 'ANYWAY, THIS', 'IS PERFECT. GET ME', 'SOMETHING TO DRINK.', 'a magic-nose job, j “', 'Sie saee', 'aa', 'A Sol. ', ""FUCK YOU. I'D RATHER DIE THAN DO THAT."", 'D-did  hit to hard?', 'GET CLOSE TO ME FOR A SEC.', ""THAT'S WHY  TOLD YOU TO NEVER DO THAT EVER AGAIN. ""], ['AFTER OUR FAMILY FELL,', 'THE MAGIC TOWER HAS BEEN LED BY THE SIX FAMILIES, THE HEXAGRAM’.', ""HE'S A MEMBER OF ONE OF THE FAMILIES IN THE HEXAGRAM, A SON OF THE NERESTER FAMILY,"", 'AND AFTER HE GRADUATED EARLY FROM THE ACADEMY,', ""HE WAS ON A COURSE TO BECOME A PROFESSOR. HE'S AN ELITE."", ""ALTHOUGH HE'S BEEN WALKING IN THE EXACT OPPOSITE DIRECTION OF MY PATH,"", ""HE'S ONE OF THE ONLY ONES WHO HAVE BEEN BY MY SIDE!"", 'WHAT’S WRONG WITH', ""YOU'RE GROSSING ME OUT..."", 'DIAMOND DRAGON?', 'WHY ARE YOU GIVING THIS TO ME? '], [""ALTHOUGH THEY'RE AN ANCIENT SPECIES THAT HAVE BEEN RECENTLY DISCOVERED,"", ""APPARENTLY, THEY'VE RECENTLY"", 'FOUND A NEST OF THEM.', 'YOU TO JOIN THE EXPEDITION CREW TOO.', 'ANCIENT DRAGON SPECIES!', 'ALTHOUGH THEY SHOULD BE EXTINCT,', 'THEY FOUND THE NEST OF A DRAGON, WHO ARE CONSIDERED TO BE THE SOURCE OF ALL MAGIC?', 'IF YOU HAPPEN TO FIND AN ARTIFACT, DON’T YOU THINK THE ACADEMY WOULD TURN A BLIND EYE ON YOUR EXPULSION?', 'Take a look at the map too', 'AND IT WOULD BE ALL THANKS TO YOURS TRULY.', ""AMAZING! IT'S NOT JUST EXPULSION THOUGH?"", ""MAYBE THE DRAGON'S NEST HAS SOMETHING THAT COULD CURE MY BLOCKAGE DISEASE’"", '«e THERE’S NO POINT. EVEN IF  FIND SOMETHING LIKE THAT, IT WOULD BE COLLECTED BY THE DEAN ANYWAY...'], ['WHY ARE YOU HITTING THE TABLE LIKE THAT?', ""WHAT? WHY DIDN'T  KNOW?"", 'THIS IS THE HEAVENS GIVING ME A CHANCE.', 'THIS CRAZY BASTARD, WHAT ARE YOU...?', 'ZA  Stesagas   DISS a  Sess']]","In this chapter, we delve into the struggles of a character suffering from a rare condition known as Blockage Disease, which prevents him from using magic. **Your body suffers from a rare disease where mana is unable to flow freely,** a doctor explains. Despite the prognosis, the character tries to reassure his worried sister, **I’ll be cured from my disease soon!** as she anxiously asks, **What did the doctors say? Did they find a cure?**While grappling with his condition, he reflects on his academic failures, stating, **This marks my third time failing,** indicating the pressure of maintaining his family's pride as a descendant of a prestigious lineage. He laments, **A mere profession like that can’t bring back glory to my family.** The reality of his academic struggle is compounded when he receives insults from peers regarding his grades and the burden of expectations, **How can he be so consistent at your grades?**A friend from a prominent family, Sean Nester, tries to offer help but also reveals a potential opportunity, **You should join the expedition crew too,** referring to a recent discovery of an ancient dragon's nest, which could hold valuable resources. The protagonist struggles with the situation, **Even if I find something like that, it would be collected by the dean anyway.**Ultimately, this chapter highlights the tension between ambition and adversity, as well as the protagonist's internal conflict over his future, expressed when he finally contemplates, **This is the heavens giving me a chance.**"
00f61f40-f463-4b8e-8376-b4d761fac0bd,Talent-Swallowing Magician,2.0,"['https://cnn.kadkomi.com/komic/asura-scans/talent-swallowing-magician/chapter-2/1.webp', 'https://cnn.kadkomi.com/komic/asura-scans/talent-swallowing-magician/chapter-2/10.webp', 'https://cnn.kadkomi.com/komic/asura-scans/talent-swallowing-magician/chapter-2/2.1.webp', 'https://cnn.kadkomi.com/komic/asura-scans/talent-swallowing-magician/chapter-2/2.2.webp', 'https://cnn.kadkomi.com/komic/asura-scans/talent-swallowing-magician/chapter-2/3.1.webp', 'https://cnn.kadkomi.com/komic/asura-scans/talent-swallowing-magician/chapter-2/3.2.webp', 'https://cnn.kadkomi.com/komic/asura-scans/talent-swallowing-magician/chapter-2/4.1.webp', 'https://cnn.kadkomi.com/komic/asura-scans/talent-swallowing-magician/chapter-2/4.2.webp', 'https://cnn.kadkomi.com/komic/asura-scans/talent-swallowing-magician/chapter-2/5.1.webp', 'https://cnn.kadkomi.com/komic/asura-scans/talent-swallowing-magician/chapter-2/5.2.webp', 'https://cnn.kadkomi.com/komic/asura-scans/talent-swallowing-magician/chapter-2/6.1.webp', 'https://cnn.kadkomi.com/komic/asura-scans/talent-swallowing-magician/chapter-2/6.2.webp', 'https://cnn.kadkomi.com/komic/asura-scans/talent-swallowing-magician/chapter-2/7.webp', 'https://cnn.kadkomi.com/komic/asura-scans/talent-swallowing-magician/chapter-2/8.1.webp', 'https://cnn.kadkomi.com/komic/asura-scans/talent-swallowing-magician/chapter-2/8.2.webp', 'https://cnn.kadkomi.com/komic/asura-scans/talent-swallowing-magician/chapter-2/9.webp']","[['TALENT-SWALLOWING MAGICIAN'], ['iw Npe a rp ces ee ae cote as  aS Gate Sle aa Gam “BL.  A. Goats di', 'BE HERE.', 'THANKFULLY, NO ONE IS LISTENING.', 'WATCH YOUR MOUTH... DO YOU KNOW HOW MANY PROFESSORS TOOK PART IN THIS?', ""YOU'RE CHALLENGING ALL THOSE BIG SHOTS AT ONCE!"", 'SHOULD I SMASH YOU IN THE HEAD AGAIN,', 'MY FRIEND... '], ['ARPES sa SOB', 'THE CRACK FORMED FROM TWO STRATA COLLIDING.', 'AND THE HUGE AMOUNT OF MANA FLOWING OUT FROM THE CRACKS.', 'THIS MUCH WOULD HAVE BEEN ACCUMULATED FOR AT LEAST ,', ""LOGICALLY SPEAKING, IT’S NO WONDER YOU WOULD THINK THE DRAGON'S NEST WOULD BE HERE.""], ['WHAT ARE THE THREE PRIN- CIPLES OF MANA', '.. ARE YOU MAKING FUN OF ME RIGHT', 'NOW?', 'OF COURSE, YOU WOULD KNOW THE BASICS LIKE THIS, RIGHT, ASSISTANT PROFESSOR?'], [""FROM THE PRINCI- PLES, YOU ALL MUST HAVE BEEN CERTAIN THAT THIS WAS THE DRAGON'S NEST."", 'SINCE VERY HOT MAGMA FLOWS THROUGH THE', 'MANA DOES NOT GATHER THERE, THEREFORE, A DRAGON CANNOT LIVE THERE.'], ['THE AKRAN VOLCANO’S MAGMA RUNS UNDER THE CONTINENT.', 'B-BUT WE', 'RECORDED THE MANA WAVELENGTHS OF A DRAGON NEAR THE AREA!', ""THERE'S NO WAY THE NEST ISN'T THERE..."", ""I NEVER SAID THERE WASN'T A NEST, THOUGH."", 'THERE IS DEFINITELY A NEST.', 'RIGHT HERE, IN THE KARAGUL CAVE.'], ['y', ""IT'LL DEFINITELY BE HERE."", 'HOW DOI TELL THE HIGHER-UPS ABOUT THIS?'], ['I MIGHT GET CHASED OUT IF I PISS OFF THE DEAN...', 'BUT IF WHAT ELRIC SAID S RIGHT, THEN THAT BASTARD...', 'WHAT ARE YOU DOING IN THE TRAINING', 'ROOM BY YOURSELF...', 'I HAVE TO USE MAGIC...', 'WHATEVER IT TAKES...', 'BLOCKAGE DISEASE...'], ['THAT SON OF A BITCH... HE MIGHT', 'BE ABLE TO CURE ; HIS BLOCKAGE DISEASE.', 'IF SO, THEN AS HIS FRIEND...', 'T HAVE TO HELP HIM!!', ""WHAT YOU'RE SAYING IS THAT..."", 'MY RESEARCH REPORT IS', 'WRONG?', 'I WAS JUST HOPING TO GET YOUR OPINION SINCE THERE IS A POSSIBILITY...'], ['THOUGH I DON’T KNOW HOW YOU CAME TO THAT CONCLUSION,', 'DON’T MANAGE TO CONVINCE ME...', 'THEN EVEN IF YOU ARE THE SON OF THE NERESTER FAMILY,', 'I WILL NOT JUST LET THIS PASS.', 'THIS IS THE POWER OF A TH-CIRCLE MAGICIAN...'], ['I APOLOGIZE FOR ENTERING ON MY OWN LIKE THIS.', 'OHO, LOOK AT HIM...', 'WAS THE ASSISTANT PROFES- SOR’S DEDUCTION YOUR OPINION?', ""YES, THAT'S T - CORRECT."", 'I APPLAUD YOU FOR YOUR INSIGHT AND DISCERNMENT. IT’S HARD TO BELIEVE THAT', 'A STUDENT THOUGHT OF SOMETHING LIKE THIS.', 'BUT DOESN’T THIS HAVE ABSOLUTELY NO EVIDENCE BEHIND IT, AND IS JUST A GUESS?', 'IT’S A BASIC TRUTH THAT EVEN A THREE YEAR-OLD', 'WOULD KNOW...'], ['BUT YOU NEED EVIDENCE?', 'S THIS BASTARD CRAZY?! WHY ARE', 'YOU TAUNTING HIM?!!', ""YOU FUCKING DEMON... YOLI’RE NOT HERE TO HELP ME, BUT RATHER TO KILL THE ONE PERSON WHO'S HELPING YOU..."", 'ARE YOU SAYING THAT MY GUESS IS WRONG?', ' THERE ARE FEW', 'WHO COME ACROSS SOME STROKE OF LUCK. '], ['TRASH WHO RUN THEIR MOUTHS WITHOUT KNOWING THEIR PLACE... _', ""BUT AS A PROFESSOR, I CAN'T JUST IGNORE A STUDENT’S OPINION..."", ""YES... THAT'S RIGHT! YOU..."", ""WON'T YOU MAKE A BET WITH ME?"", 'A BET... WHAT KIND?', 'I WILL GIVE YOU ALL THE RESOURCES YOU NEED TO FORM', 'AN EXPLORATION', 'BUT IF YOU FAIL...'], [' WHY DON’T YOUBET THE . ONE HEIRLOOM’ ', 'THE FIRST HEADMASTER LEFT BEHIND?', 'a eyes', 'aA -AWAR  ABC op A Eesy  S, g']]","In this chapter of Talent-Swallowing Magician, a heated discussion unfolds among professors and students about the existence of a dragon's nest. One character expresses skepticism about their findings, provoking another who believes they have undeniable evidence. Watch your mouth... do you know how many professors took part in this? a professor warns, hinting at the gravity of their research. However, another character argues, The mana does not gather there, therefore, a dragon cannot live there. This back and forth reveals tensions surrounding the research.Despite doubts, one character insists, There is definitely a nest... right here, in the Karagul Cave. As tensions escalate, another exclaims, What you’re saying is that... my research report is wrong? revealing their frustration and the high stakes involved.In a dramatic twist, one character proposes a bet: I will give you all the resources you need to form an exploration, but if you fail... bet the heirloom the first headmaster left behind. This proposition adds pressure, setting the stage for future confrontations and challenges as they seek the elusive dragon's nest."
