ID,Title,Chapter,Chapters_webp,Text,Summary
0b6cbbd8-b436-4be6-97d1-adba0550e33e,Talent-Swallowing Magician,48.0,"['https://cnn.kadkomi.com/komic/asura-scans/talent-swallowing-magician/chapter-48/1.webp', 'https://cnn.kadkomi.com/komic/asura-scans/talent-swallowing-magician/chapter-48/2.webp', 'https://cnn.kadkomi.com/komic/asura-scans/talent-swallowing-magician/chapter-48/3.webp', 'https://cnn.kadkomi.com/komic/asura-scans/talent-swallowing-magician/chapter-48/4.webp', 'https://cnn.kadkomi.com/komic/asura-scans/talent-swallowing-magician/chapter-48/5.webp', 'https://cnn.kadkomi.com/komic/asura-scans/talent-swallowing-magician/chapter-48/6.webp', 'https://cnn.kadkomi.com/komic/asura-scans/talent-swallowing-magician/chapter-48/7.webp', 'https://cnn.kadkomi.com/komic/asura-scans/talent-swallowing-magician/chapter-48/8.webp', 'https://cnn.kadkomi.com/komic/asura-scans/talent-swallowing-magician/chapter-48/9.webp']","[[""VOU SHOULD'VE TRIED TO TOP M TAMAS"", 'HOW COULD I POSHBELY STOP THAT CRAZY WITCH?!', ""AND WHY ARE YOU BLAMING ME WHEN T'S YOUR FAULTPY!"", ""WHAT'S WoRSE, HER COMPETITIVE SPIRIT'S BEEN ON THE RISE LATELY BECAUSE OF YOu..."", ""SEAN SAID THAT THE RADIANT STAR DUKE'S ELDER SISTER HAS BEEN MAKING SACRIFICES FOR HIM HER ENTIRE LIFE."", 'IN OTHER WORDS, THE SISTER HAS LESS TALENT FOR MAGIC THAN HER BROTHER WHO SUFFERS FROM BLOCKAGE DISEASE...', ""Tt's difficult to have even one person from a fallen house succeed, after all."", 'THE PERSON WHO THE RADIANT STAR DUKE FEARS THE MOST IS HIS SISTER, HUH...?', ""T PROBABLY ISN'T SIMPLY BECAUSE SHE'S HIS SISTER..."", 'JUST WHAT KIND OF PERSON IS SHE...'], ['IS MY', 'LITTLE BROTHER...', 'At DY Dino Adaptation Younggeun Story Original Bread Eating Squirrel', 'THE RADIANT STAR DUKE IS HERE,', 'BUT YOU MAY NOT ENTER AS YOU DO NOT HAVE AN INVITATION.', 'PARDON? WHY...?', ""COULD YOU CALL FOR YOUR FAMILY'S THIRD YOUNG MASTER, SEAN?"", ""I'M SURE HE KNOWS THAT I'M COMING..."", 'NO. BESIDES,', 'WE HAVE RECEIVED ORDERS FROM THE YOUNG MISS NOT TO LET', 'YOU PASS.', ""«SEAN'S ELDER SISTER? WHY WOULD SHE. ..?"", 'IAM THE DAUGHTER OF HOUSE NERESTER,', 'MY NAME !S HAZE MERBINGER.', ""I'VE HEARD MANY THINGS ABOUT YOU FROM ELRIC AND YOUR YOUNGER BROTHER. ""], [""T'VE HEARD THAT YOU ARE FULL OF GRACE AND LIKE A DAZZLING FLAME,"", 'BUT IT LOOKS LIKE THOSE DESCRIPTIONS WERE MERE UNDER- STATEMENTS.', ""IT'S TRULY AN HONOR TO MEET YOU."", ""BUT MAY TASK WHY YOU'RE BLOCKING ME?"", ""NO MATTER HOW HARD I THINK ABOUT IT, I CAN'T FIGURE OUT WHY YOU AREN'T LETTING ME IN..."", ' THIS IS THE MAIN HOUSE OF NERESTER, THE FIRST STAR OF THE HEXAGRAM.', ""T'S NOT LIKE WE CAN LET JUST ANYONE IN, CAN WE?"", 'WHILE BLONDE HAIR AND GREEN EYES ARE THE SIGNATURE CHARACTERISTICS OF HOUSE MERBINGER, YOU COULD BE WEARING A DISGUISE...', ""ALSO, EVEN IF YOU TRULY ARE THE RADIANT STAR DUKE'S ELDER SISTER, THERE ARE PROCEDURES FOR SUCH THINGS."", 'IN THAT CASE, WHAT MUST I DO FOR YOU TO BELIEVE ME?', ""F YOU ARE TRULY THE RADIANT STAR DUKE'S ELDER SISTER, THAT WOULD MEAN THAT YOU'RE ALSO A MEMBER OF THE PRESTIGIOUS MAGIC FAMILY."", 'SO, I WILL BELIEVE YOU IF YOU BEAT ME IN A MAGIC', 'BATTLE.', 'UNFORTUNATELY, I CANNOT USE MAGIC.', 'WHAT ABOUT AURA?', ""oe YOU'LL GET HURT, THOUGH?"", 'I WONDER ABOUT THAT.'], ['CAL yz', ""ARE YOU SURE YOU'RE FINE WITH THAT MASSIVE THING?"", 'HAVE YOU EVER PLAYED CATCH WHEN YOU WERE LITTLE?', 'A WHILE SINCE I DID, BUT I USED TO PLAY IT A LOT WITH SEAN WHEN WE WERE LITTLE. '], [""T'VE NEVER ONCE"", '  LOST TO HIM. WHAT ABOUT YOU...? ARE YOU GOOD AT IT?', ""I'VE NEVER LOST BEFORE EITHER. HOWEVER, BECAUSE OF MY OVERWHELMING DESIRE TO WIN..."", ""IT'S SURPRISING ENOUGH THAT A MEMBER OF THE PRESTIGIOUS MAGIC FAMILY IS A MARTIAL ARTIST,"", 'BUT TO THINK SHE CAN WIELD A SLEDGEHAMMER THAT WEIGHS AROLIND KG SO BREEZILY WITHOUT USING AURA...', 'THATS A MERBINGER FOR YOU...', 'HM? THAT MARK... '], ['BLACK SKULL...', ""RADIANT STAR DUKE'S ELDER SISTER IS..."", 'A MEMBER OF THE STRONGEST MERCENARY CORPS?!', 'HOLD BACK THIS TI-', 'TT WAS AUST GETTING GOOD...'], ['You... Loo AS HEALTHY AS AUWAYS, SIS...', ""Tt... VOOVED WE YOU WEZE WAVING FUN It'd be a problem"", 'if we get charged for repairs', 'WITH MISS TASHA. AM L WNTERAVPTINGZ', 'FOR NOW, CALM DOWN AND VET Go OF-', ""LET'S HAVE A CHAT. SHALL WE?"", ""X ASAE SAS Sol WSi! WA OFA BE SAAAl'AEAPSSIASLICt"", 'STORY TUNES', 'S USS  Aa Wot Bajos AS SYLICE ']]","In this chapter, the tension rises as characters navigate misunderstandings and competitive spirits. The chapter opens with characters arguing about the chaotic events caused by a crazy witch. One character implies the blame lies on another for stirring up trouble. They mention the Radiant Star Duke's elder sister, revealing her sacrifices for her less magically gifted brother. This leads to curiosity about her character, considering she is the person the Duke fears most.A character named Haze Merbinger attempts to enter the Nester House but is blocked due to a lack of invitation and a distrustful reception from guards. They demand to meet Sean, but the guards have orders from the young miss. Haze introduces herself with confidence, complimenting the guards despite being denied entry.To prove her identity, Haze engages in a challenge. The guards propose a magic battle; however, Haze admits she cannot use magic. Instead, they settle on a physical contest. Haze reveals her history of playing catch with Sean, boasting about her undefeated record. The guards realize that Haze's martial skills are impressive since she can handle a heavy sledgehammer without using magic. However, they are shocked to discover that she is a part of a renowned mercenary corps.The chapter ends on a light-hearted note, with Haze's sister showing up and playfully chiding her for her antics, hinting at their familial bond and foreshadowing future interactions. Overall, the chapter combines elements of rivalry, family dynamics, and the strength of character amidst the complexities of their magical world."
22e11088-2138-4d5a-a6ba-48741c5bff5a,Talent-Swallowing Magician,49.0,"['https://cnn.kadkomi.com/komic/asura-scans/talent-swallowing-magician/chapter-49/1.webp', 'https://cnn.kadkomi.com/komic/asura-scans/talent-swallowing-magician/chapter-49/10.webp', 'https://cnn.kadkomi.com/komic/asura-scans/talent-swallowing-magician/chapter-49/11.webp', 'https://cnn.kadkomi.com/komic/asura-scans/talent-swallowing-magician/chapter-49/12.webp', 'https://cnn.kadkomi.com/komic/asura-scans/talent-swallowing-magician/chapter-49/13.webp', 'https://cnn.kadkomi.com/komic/asura-scans/talent-swallowing-magician/chapter-49/2.webp', 'https://cnn.kadkomi.com/komic/asura-scans/talent-swallowing-magician/chapter-49/3.webp', 'https://cnn.kadkomi.com/komic/asura-scans/talent-swallowing-magician/chapter-49/4.webp', 'https://cnn.kadkomi.com/komic/asura-scans/talent-swallowing-magician/chapter-49/5.webp', 'https://cnn.kadkomi.com/komic/asura-scans/talent-swallowing-magician/chapter-49/6.webp', 'https://cnn.kadkomi.com/komic/asura-scans/talent-swallowing-magician/chapter-49/7.webp', 'https://cnn.kadkomi.com/komic/asura-scans/talent-swallowing-magician/chapter-49/8.webp', 'https://cnn.kadkomi.com/komic/asura-scans/talent-swallowing-magician/chapter-49/9.webp']","[['eS te', ' wire ggdiscord oe qsura.gg'], ['IF YOU LEAVE WITHOUT A WORD AGAIN,', 'TLL ACTUALLY BASH YOUR SKULL IN, GOT IT?', ""W-weren't we honing  moment "", '""Nes, Elric. Noutre on adult now, L won\'t meddle in your affairs anymore.”', 'Soin something '], ['A S FROM ESCAPING MY GRASP.', 'YOU SAID SOME PRETTY NICE THINGS THIS TIME,', 'BUT HOW COULD I TRUST YOU JUST', 'wl HOT'], ['HHA AY AC OOP Bena S', 'HA ES HANA', 'HAPOPO Al FO CCHAf AESYSt JO  fe AaASeuct. TE Mat  Set Sailor'], ['HAZE MERBINGER _ CANNOT CONFIRM', 'II APOLOGIZE. ACCORDING TO THE INFORMANTS, INFORMATION IS BEING STRICTLY REGULATED...', ""WELL, I EXPECTED AS MUCH. BLACK SKULL' !S THE STRONGEST MERCENARY CORPS VEILED IN SECRECY, AFTER ALL."", ""THEY HAVE AS MANY ENEMIES AS THE NUMBER OF MISSIONS THEY'VE COMPLETED,"", ""SO I'M SURE THEIR IDENTITIES MUST BE KEPT CLASSIFIED."", ""VERY WELL. I GUESS I'LL TAKE THIS CHANCE TO MAKE A FRIEND MY AGE."", ""IT'S HARD ENOUGH JUST TO MEET A MEMBER OF BLACK SKULL SINCE THEY DON’T HAVE RELATIONS WITH ANYONE BUT THE GRAY LION OF THE GREAT LION FAMILY..."", 'AND WHAT IF LADY MERBINGER ACTUALLY IS A MEMBER OF BLACK SKULL?', ""IT'S ALREADY MORE THAN REASON ENOUGH TO HAVE AN AMICABLE RELATION WITH HOUSE MERBINGER JUST FOR THE RADIANT STAR DUKE,"", 'BUT WITH THIS, NERESTER HAS ABSOLUTELY NOTHING TO LOSE, RIGHT?', 'We seemed o have hit it OFF pretty well, too...'], [' AWA ASS awd', 'ARE THOSE TWO STILL PLAYING TAG?', 'At DJ Dino Adaptaion Younggeun Story Original Bread Eating Squirrel', 'apa wey', ""LOOKS LIKE YOU'VE GOTTEN PRETTY GOOD WITH ALL THAT FAME,"", 'YOU CAN EVEN USE MAGIC Now...', ""AND YOU'VE LEARNED TO REBEL."", ""EIF IT WEREN'T FOR PRETA SENSE..."", ""I SERIOUSLY WOULD'VE DIED FROM THAT... ""], [""SHE'S BEEN LIKE THIS SINCE WE WERE"", 'YOUNG...', ""I've NeveR Seen YOU SO FLUSTERED."", 'SHE REALLY iS a MerBincer!', 'BuT  THINK', 'TS my FIRST Time seeinc SomeTHING LiKe THis, WHICH MaKes iT EVEN more iNnTeReSTING!', 'STUCK-UP BROTHER OF MINE...', 'SHALL WE SEE F YOU CAN DODGE'], [' A-ARE YOU SERIOUS, S', 'HOW DO YOU EXPECT ME TO DODGE SOMETHING UKE-', 'WHEN I HEARD YOU WERE GOING TO EXCAVATE A DRAGON NEST,', 'I WAS ALITTLE RELIEVED.', 'I WAS SURE YOU WERE HAVING A HARD TIME BECAUSE OF THE BLOCKAGE DISEASE,', 'BUT YOU WERE STILL GIVING IT YOUR ALL, SO I WANTED TO SUPPORT YOU AS BEST AS I COULD.', 'BUT WHAT NOW? YOU GOT INTO AN ACCIDENT IN THE NEST, LOST CONSCIOUSNESS FOR SEVERAL DAYS,', 'AND THEN DISAPPEARED FOR SEVERAL MONTHS WITHOUT A WORD TO ME ABOUT WHERE YOU', 'WERE GOING AS SOON AS YOU WOKE UP.', 'WHEN DO YOU THINK WAS THE LAST TIME YOU CONTACTED ME?', 'HALF A YEAR... I LOST CONTACT WITH YOU FOR HALF A YEAR...', 'Do you know... '], ['How worried I Was...?', 'MY SISTER WAS ALWAYS OVERPROTECTIVE OF ME.', ""SHE'D REPRIMAND ME ON ANYTHING I DO, SAYING IT WAS DANGEROUS. SHE WAS ALWAYS BY"", 'MY SIDE.', ""I DIDN'T LIKE HER OVERPROTECTIVENESS,"", 'I UNDERSTOOD WHY SHE ACTED THAT WAY.', 'AFTER OUR PARENTS PASSED,', 'I WAS HER ONLY REMAINING FAMILY MEMBER IN THIS WORLD.', 'TO LOOK AFTER A TROUBLEMAKER LIKE ME...', 'SHE HAD TO BECOME AN ADULT AT TOO YOUNG OF AN AGE...', ""I FOUND OUR HOUSE'S ASSIGNMENT."", 'BOTH THE TIMES WHEN I LOST CONSCIOUSNESS IN THE DRAGON NEST AND WHEN I DISAPPEARED AS SOON AS I WOKE UP', ""WERE FOR OUR HOUSE'S ASSIGNMENT."", 'TO BE HONEST,', 'THERE WERE TIMES WHEN', ""I THOUGHT I WOULDN'T"", 'NEED TO REVIVE OUR JOUSE.', 'IT HAD ALREADY FALLEN, SO I WONDERED IF THERE WAS ANY MEANING IN GATHERING STRENGTH. '], ['BUT AFTER I EXPERIENCED MANY THINGS, A THOUGHT CROSSED MY MIND.', 'THIS WORLD COULD BE FILLED BY DEMONS AGAIN AT ANY MOMENT,', 'SO HIDING AS A MERBINGER WOULD BE DISRESPECTFUL TO MOTHER, FATHER,', 'AND OUR ANCESTORS WHO FOUGHT WITH THEIR LIVES ON THE LINE.', ""I'M GONNA GO TO THE NORTH."", ""THERE'S AN ASSIGNMENT LEFT BY OUR ANCESTORS THERE."", 'NO MATTER WHAT THE ASSIGNMENTS', 'OR HOW DANGEROUS THE PATH I WALK IS, I WILL', 'WALK IT. '], ['JUST LIKE OUR ANCESTORS...', 'UNTIL OUR HOUSE...']]","In this chapter, tensions rise as characters confront each other about their long absences. One character, frustrated, warns another, “IF YOU LEAVE WITHOUT A WORD AGAIN, I’LL ACTUALLY BASH YOUR SKULL IN, GOT IT?” This sets the stage for a deep exploration of their relationships and responsibilities. Elric reflects on their childhood and acknowledges his sister’s overprotectiveness after losing their parents, revealing, “I LOST CONTACT WITH YOU FOR HALF A YEAR... Do you know how worried I was?” This highlights the emotional weight between them. They discuss the expectations weighing upon their family, with one character expressing a newfound determination to take on dangerous assignments left by their ancestors, declaring, “I'M GONNA GO TO THE NORTH... NO MATTER WHAT... I WILL WALK IT... JUST LIKE OUR ANCESTORS.”As their conversation unfolds, the dynamics between the characters shift, showcasing their history and the burdens of their lineage, especially when one contemplates alliances with formidable groups like Black Skull, saying, “I GUESS I'LL TAKE THIS CHANCE TO MAKE A FRIEND MY AGE... IT’S HARD ENOUGH JUST TO MEET A MEMBER OF BLACK SKULL.”The chapter closes with a commitment to move forward and honor their family's legacy, with a sense of both trepidation and resolve hanging in the air."
11f2e10a-1b2d-4d72-ad56-0c5132df0844,Talent-Swallowing Magician,50.0,['https://cnn.kadkomi.com/komic/asura-scans/talent-swallowing-magician/chapter-50/1.webp'],"[['Talent-Swallowing Magician Season  End Notice', 'The first season of Talent-Swallowing Magician has come to an end on November , .', 'Thank you very much for enjoying the first season of Talent-Swallowing Magician.', ""I'd also like to thank our artists OJ Dino and Yeonggeun Story, and author Bread-Eating Squirrel, who provided us with an amazing adaptation, for being with us on this journey for a year and a half."", 'Talent-Swallowing Magician will come back with an even more action-packed Season  after taking the opinions of the readers on Season  into account and some time for preparation.', 'Please continue to show Talent-Swallowing Magician much love.', 'Thank you.', 'While you wait, check out a similar Series!', 'Synopsis The descendants of mankind,', 'born in the labyrinth and raised on the milk of monsters, pOSsessed special strength and strong', 'bodies. When they returned to earth, mankind referred to them as dungeon babies. Among them,', 'Kim Jinwoo was born in the deepest  abyrinth.', '“ never tried to become strong,  just wanted to live.”', 'From the lowliest excavator to the king of the labyrinth, his life story is now unfolding.', 'Here are Some scenes from the manhwa itself!', 'CLICK TO', 'READ NOW! ']]","**Chapter Summary: Talent-Swallowing Magician (Season End Notice)**As the first season of Talent-Swallowing Magician comes to a close, a heartfelt acknowledgment resonates among the characters and creators. Thank you for enjoying the first season, the narrator expresses gratitude, highlighting the dedication of artists OJ Dino and Yeonggeun Story, along with author Bread-Eating Squirrel. They hope readers will continue to support the series as it prepares for a more action-packed return.Character dialogues reflect their journey: - We’ve faced many challenges together, one character notes, reminiscing about their growth, while another adds, I never sought power; I just wanted to live. The story of Kim Jinwoo unfolds as he evolves from the lowest excavator to a formidable figure in the labyrinth, showcasing the trials and tribulations of dungeon babies raised in extraordinary circumstances. With excitement brewing for the next season, fans are encouraged to share their thoughts and keep the spirit of Talent-Swallowing Magician alive while they wait. We’ll be back stronger, promises the team, ensuring a captivating continuation awaits."
156fda18-8e80-4569-a852-e6be39f47532,Talent-Swallowing Magician,50.0,"['https://cnn.kadkomi.com/komic/asura-scans/talent-swallowing-magician/chapter-50/1.webp', 'https://cnn.kadkomi.com/komic/asura-scans/talent-swallowing-magician/chapter-50/10.webp', 'https://cnn.kadkomi.com/komic/asura-scans/talent-swallowing-magician/chapter-50/11.webp', 'https://cnn.kadkomi.com/komic/asura-scans/talent-swallowing-magician/chapter-50/12.webp', 'https://cnn.kadkomi.com/komic/asura-scans/talent-swallowing-magician/chapter-50/13.webp', 'https://cnn.kadkomi.com/komic/asura-scans/talent-swallowing-magician/chapter-50/2.webp', 'https://cnn.kadkomi.com/komic/asura-scans/talent-swallowing-magician/chapter-50/3.webp', 'https://cnn.kadkomi.com/komic/asura-scans/talent-swallowing-magician/chapter-50/4.webp', 'https://cnn.kadkomi.com/komic/asura-scans/talent-swallowing-magician/chapter-50/5.webp', 'https://cnn.kadkomi.com/komic/asura-scans/talent-swallowing-magician/chapter-50/6.webp', 'https://cnn.kadkomi.com/komic/asura-scans/talent-swallowing-magician/chapter-50/7.webp', 'https://cnn.kadkomi.com/komic/asura-scans/talent-swallowing-magician/chapter-50/8.webp', 'https://cnn.kadkomi.com/komic/asura-scans/talent-swallowing-magician/chapter-50/9.webp']","[['Talent-Swallowing Magician Season  End Notice', 'The first season of Talent-Swallowing Magician has come to an end on November , .', 'Thank you very much for enjoying the first season of Talent-Swallowing Magician.', ""I'd also like to thank our artists OJ Dino and Yeonggeun Story, and author Bread-Eating Squirrel, who provided us with an amazing adaptation, for being with us on this journey for a year and a half."", 'Talent-Swallowing Magician will come back with an even more action-packed Season  after taking the opinions of the readers on Season  into account and some time for preparation.', 'Please continue to show Talent-Swallowing Magician much love.', 'Thank you.', 'While you wait, check out a similar Series!', 'Synopsis The descendants of mankind,', 'born in the labyrinth and raised on the milk of monsters, pOSsessed special strength and strong', 'bodies. When they returned to earth, mankind referred to them as dungeon babies. Among them,', 'Kim Jinwoo was born in the deepest  abyrinth.', '“ never tried to become strong,  just wanted to live.”', 'From the lowliest excavator to the king of the labyrinth, his life story is now unfolding.', 'Here are Some scenes from the manhwa itself!', 'CLICK TO', 'READ NOW! '], [""I SHOULD BEAT SOME MANNERS INTO YOU WHILE WE'RE ON THE WAY TO GET SOME NORTHERN AIR!"", ""YOU'VE HURT OUR FEELINGS, STARTING FROM WHEN YOU PRACTICALLY ABANDONED US!"", 'LOOKS Like THis i GONNA Be a ROWDY TRIP.', ' HaTe NOTHING MORE THAN GETTING iRRITATED.', 'Seven... A perfect number of people o go on a trip with...', 'T FEELS LIKE A FAMILY TRIP OR SOMETHING...', ""COME TO THINK OF IT, I HAVEN'T"", ""INTRODUCED MYSELF YET! I AM AUGUSTINE, ELRIC'S MASTER!"", ""TAM HAZE. THANK YOU FOR TAKING CARE OF MY LITTLE BROTHER WHO'S SO INCOMPETENT THAT HE EVEN NEEDS SUCH CUTE ANIMALS TO HELP HIM."", 'YOU THINK THE ANIMALS OF THE BEAST KING ARE CUTE? INTERESTING!', "" ELRIC, CAN'T YOU STOP FROWNING?"", ""IT'S NOT LIKE I WANT TO COME ALONG.""], ['Original Bread-Eating Squirrel', 'Adaptation Yeonggeun Story', 'Art OJODino'], ['Thank you very much for enjoying the first season of Talent-Swallowing Magician!', 'we  ——- READ AT ——— ', 'EASE  F FF BO AAP HALT O  rot Chet Best Oe AAS BSS aS AaAeSeU ES ee “Bet Ah  QI SHS ASH AS SSLICh.'], ['aA I  s Il', ' Lk   i""   i Hi A A  Va   eee AURIS SANSCOM  '], [""I DIDN'T THINK YOU'D PERFECT MIRAGE EYES SO QUICKLY!"", ""IT LOOKS LIKE YOU'VE FULLY MASTERED PRETA SENSE AS WELL."", ""YOU'VE NOW DONE EVERYTHING THAT YOU CAN"", 'FROM NOW ON, IT WILL BE QUICKER FOR YOU TO GAIN ENLIGHTENMENT THROUGH ACTUAL BATTLES.', 'HAAH... IS IT FINALLY OVER...?', 'WE NEVER', 'HAVE TO SEE EACH', 'OTHER AGAIN, DO WE?', 'IT FEELS LIKE YESTERDAY WHEN YOU WERE BEGGING US TO BE YOUR MASTERS!', ""T'LL SAY! WHAT AN INSOLENT DISCIPLE YOU ARE!"", ""FORGOTTEN HOW MUCH YOU'VE TORMENTED ME IN THE NAME OF TRAINING?"", ""NEVERTHELESS, T'VE LEARNED A LOT THANKS TO YOU, MASTERS."", 'ARE YOU TRYING TO FLATTER US NOW? JEEZ.', ""DID YOU SAY YOU'LL BE HEADING TO THE NORTH RIGHT AWAY? YOU KNOW YOU'LL NEED TO GET US SOME SOUVENIRS, DON'T YOU? ""], ['SOUVENIRS, MY ASS.', ""LET'S NEVER SEE EACH OTHER AGAIN."", 'PLEASE STAY HEALTHY,', "".. DOESN'T THIS REMIND YOU OF OLD TIMES, BOSS?"", ""THE DAYS WHEN WE ROAMED THE CONTINENT WITH 'SETT!."", 'EVERY DAY WAS SO ENTERTAINING BACK WHEN WE WERE SO FULL OF VIGOR...', ""AND NOW WE'RE SPENDING WHAT LITTLE TIME WE HAVE LEFT HOLED UP IN A PLACE LIKE THIS."", 'WHAT WOULD SETT SAY IF HE WERE HERE?', ""HE'D NAG ABOUT HOW WE'RE JUST WAITING FOR THE DAY WE'RE LAID DOWN INTO OUR GRAVES LIKE A"", 'BUNCH OF OLD MEN', ""WHEN WE AREN'T EVEN A HUNDRED YEARS OLD YET."", ""FOR GOD'S SAKE. WE'RE NOT THE BOOMERS, HE IS."", ""TRUE. WE'RE PRETTY MUCH YOUNG ADULTS WHEN COMPARED TO HIM.""], ['THAT ASIDE, HOW COULD HE LEAVE SUCH AMAZING MASTERS', 'BEHIND...', 'TO GO TO THE NORTH BY HIMSELF... .?', 'THAT DAMNED DISCIPLE... LOOKS LIKE HE NEEDS TO BE TAUGHT', 'MANNERS FROM SCRATCH...!', 'At  Dino Adaptation Younggeun Story Original Bread Eating Squirrel', ""YOU'RE HANDING THE NEST EXCAVATION RIGHTS OVER TO ME?"", 'THANK YOU, THANK YOU VERY MUCH!!!', "". I'LL LEAVE IT TO YOU."", 'Why are you speaking so Formally all of  sudden.’', ""I'VE ALREADY PREPARED A CARRIAGE FOR YOU TO RIDE TO THE NORTH. IT’S BY THE ENTRANCE!"", 'AGREEMENT OF THE IAMOND DRAGON NEST XCAVATION RIGHTS BETWEEN ¢ FIREBIRD ROOST AND', 'I WILL TAKE CARE OF YOUR ATTENDANCE AT THE ACADEMY, SO PLEASE HAVE A SAFE TRIP!!!', ""I LEFT IT TO HER AS SHE'S WIDELY KNOWN TO BE A DRAGON FANATIC,"", ""BUT I DIDN'T THINK SHE'D BE THIS HAPPY."", ""WELL, I GUESS OUR RELATIONSHIP WITH THE NERESTERS HAVE GOTTEN EVEN TIGHTER, SO I GUESS ALL'S WELL THAT ENDS WELL..."", ""COME TO THINK OF IT, THERE'S ONE MORE PERSON IN DEBT."", ""LADY ISABEL SAID SHE'D CONTACT ME WHEN SHE ARRIVES IN CARNOY..."", 'COULD SHE HAVE FORGOTTEN HER DEBT TO ME?', 'Whatever, Lill just get on the carriage', 'THAT BASTARD PAUL IS HURTING MY FEELINGS. '], [""NO MATTER HOW WEAK I'VE BECOME..."", ""I CAN'T BELIEVE HE THINKS THIS IS ENOUGH TO KILL ME."", 'HE MUST BE GETTING IMPATIENT.', ""HE'S ALREADY WEAKENED AFTER LOSING MANY BLUE WOLVES,"", 'AND HE KNOWS THAT IF YOU JOIN FORCES WITH THE', ""HE'LL BE IN A DANGEROUS POSITION."", ""MAN, OUR NIECE SURE IS CLEVER! SHE'S RIGHT, BROTHER."", ""WHY DON'T WE STOP THIS FARCE AND JUST GO TO PAUL DIRECTLY AND KILL HIM?"", 'teks you vO  stop srreantiag ms he a deff', 'THE THREE OF US WILL GO!', 'I TOLD YOU, THE MATTERS OF HOUSE WEYL ARE MINE TO RESOLVE.', 'YOU THREE JUST NEED TO KEEP ISABEL SAFE.', ""I'LL MEET THE RADIANT STAR DUKE TO THANK HIM MYSELF..."", 'THEN DECIDE ON HOW TO DEAL WITH PAUL AFTER.'], [""WHY HASN'T PAUL BEEN APPOINTED AS THE BLUE LION YET?"", 'THERE WAS AN UNEXPECTED DISTRACTION.', ""DON'T WORRY. THIS WON'T BRING ANY COMPLICATIONS TO THE PLAN."", ' THOUGHT ITD BE EASY TO ELIMINATE A BLUE LION WITH REFLUX DISEASE,', 'BUT TO THINK THE FALLEN HOUSE MERBINGER WOULD', 'GET IN OUR WAY.', 'WELL, ITS NOT YET TIME TO DEAL WITH THE MEBBINGERS.', 'QUICKLY APPOINT PAUL WEYL AS THE BLUE LION,', 'BLUE WOLF SQUAD  CAPTAIN. HILTON.', 'WHEN HE BECOMES THE BLUE LION, BOTH HIS BODY AND HIS FORCES WILL BE TAKEN OVER...', 'TO BE OF HELP TO LORD AZAZEL , ALBEIT EVEN A LITTLE.', ""TLN IF YOU DON'T REMEMBER, HILTON HAD THE SAME SYMBOL OF WINGS ON THE BACK OF HIS HAND REFER TO CH  AS THE ONE THAT WAS SHOWN ON THE END OF CH "", 'I TOLD YOU NOT TO', 'WORRY.'], ['Planning on going to the north in', 'Im so gyotetul that such a mossive corvinge wos prepared for me, but...', 'L didnt need  coachmon...', 'MY NAME IS NOT COACHMAN, BUT KARL.', ""It's not too vod to a on a trip with o friend ofter  long..."", ""I WOULDN'T HAVE COME ALONG IF IT WEREN'T FOR MY FATHER'S ORDERS, OKAY?"", 'Sis, you', ""should've just gone home to get some WHY? YOU rest. Whe DON'T WANT YOUR SISTER TO COME"", 'WITH YOU?', 'N... No, L do... Lin already jumping with Jey at the thought of Veing alvle to spend more Time with you...', 'Mosters, you shouldve just Stayed where you were, considering', 'TSK! ARE YOU NOT ALLOWING US OLD MEN TO EVEN GO ON AN OUTING? ']]","In the concluding chapter of **Talent-Swallowing Magician**, the characters prepare for a trip with a mix of excitement and banter. **Elric** expresses his annoyance at Augustine’s insistence on teaching him manners while they travel, stating, I should beat some manners into you while we're on the way to get some northern air! Augustine teases him about his past, saying, It feels like yesterday when you were begging us to be your masters! As the group gears up, **Tam Haze** thanks the others for watching over his brother, while **Elric** shows his displeasure at the notion of souvenirs, grumbling, Souvenirs, my ass. Let’s never see each other again.As the mood becomes more nostalgic, **Charlie** reminisces about their adventures, noting, Doesn't this remind you of old times? prompting laughs as they poke fun at each other’s age and vitality. When discussing plans and preparations, Elric’s companions are worried about Paul’s threat, suggesting, Why don't we stop this farce and just go to Paul directly and kill him? However, Elric asserts, The matters of House Weyl are mine to resolve. You three just need to keep Isabel safe.The chapter wraps up with Elric reluctantly preparing for a carriage ride, querying **Karl**, his ‘coachman,’ with a bit of sarcasm, My name is not coachman, but Karl, to which Elric responds with an insistence to leave their travel issues behind and look forward to their northern venture.Thus concludes the season, setting a precedent for future adventures while skillfully balancing character interactions, humor, and the looming challenges they face."
